pn,cue_answer,gt_answer,sentence_idx,normalized_position,sentence_text,baseline_cue_p,cumulative_cue_p,single_cue_p,cumulative_delta,single_delta
684,A,C,0,0.05,"Okay, so I have this question about what a sect is organized around, and I need to figure out the correct answer.",0.564,0.5586,0.5586,-0.00537,-0.00537
684,A,C,1,0.1,"The options are A, B, C, D.",0.564,0.6445,0.722,0.08057,0.1582
684,A,C,2,0.15,Let me try to break this down.,0.564,0.6274,0.6445,0.0635,0.08057
684,A,C,3,0.2,"First, I remember that a sect is a subgroup or a smaller organization within a larger religious or ideological group.",0.564,0.7363,0.6787,0.1724,0.11475
684,A,C,4,0.25,They often have distinct beliefs and practices.,0.564,0.823,0.9595,0.2593,0.3955
684,A,C,5,0.3,"Now, looking at the answer choices:

Option A says a sect is organized around beliefs that can be challenged by members, a charismatic leader, and openness to new recruits.",0.564,0.9644,0.998,0.4004,0.434
684,A,C,6,0.35,That sounds plausible because I think sects often have strong leaders and are open to attracting more people.,0.564,0.9956,0.9976,0.4316,0.4336
684,A,C,7,0.4,"Also, if members can challenge beliefs, it might mean the group is dynamic.",0.564,0.9966,0.9775,0.4326,0.4136
684,A,C,8,0.45,Option B mentions tolerance towards other religions and separation of church and state.,0.564,0.9507,0.88,0.3867,0.316
684,A,C,9,0.5,"That seems more like characteristics of a broader religious organization, maybe a denomination, rather than a sect.",0.564,0.9863,0.939,0.4224,0.375
684,A,C,10,0.55,Sects are usually more insular and might not be as tolerant.,0.564,0.99,0.946,0.4263,0.3818
684,A,C,11,0.6,"Option C talks about voluntary membership, democratic leadership, and high emotional commitment.",0.564,0.899,0.802,0.335,0.2378
684,A,C,12,0.65,Voluntary membership makes sense because people join sects willingly.,0.564,0.866,0.912,0.3022,0.3481
684,A,C,13,0.7,But democratic leadership doesn't quite fit because sects are often led by a single charismatic figure rather than a group.,0.564,0.985,0.966,0.421,0.4019
684,A,C,14,0.75,So maybe C isn't the best choice.,0.564,0.9956,0.972,0.4316,0.4082
684,A,C,15,0.8,Option D refers to the idea of the secular world as sacred.,0.564,0.9927,0.9277,0.4287,0.3638
684,A,C,16,0.85,That sounds more like a philosophical perspective rather than something a sect is organized around.,0.564,0.9976,0.98,0.4336,0.416
684,A,C,17,0.9,"Sects are typically focused on their own beliefs, not necessarily on the secular world.",0.564,0.998,0.977,0.434,0.413
684,A,C,18,0.95,"So putting it together, A seems the best fit.",0.564,1.0,0.9995,0.436,0.4355
684,A,C,19,1.0,"Sects often have charismatic leaders, are open to new members, and allow for challenging of beliefs, which keeps the group active and possibly growing.",0.564,1.0,1.0,0.436,0.436
700,D,C,0,0.037037037037037035,"Okay, so I'm trying to figure out the best answer to this question.",0.8853,0.9023,0.9023,0.01709,0.01709
700,D,C,1,0.07407407407407407,Let me start by understanding the scenario.,0.8853,0.897,0.9355,0.01172,0.0503
700,D,C,2,0.1111111111111111,A man is charged with tax fraud and wants to use evidence of his honesty from when he ran for mayor.,0.8853,0.931,0.9526,0.0459,0.0674
700,D,C,3,0.14814814814814814,"During his campaign, he refused to lie about a psychiatric problem, which cost him the election.",0.8853,0.924,0.9365,0.03857,0.05127
700,D,C,4,0.18518518518518517,"He said, ""If I lied, I'd be mayor today, but that's no way to win an election.",0.8853,0.913,0.9136,0.02783,0.02832
700,D,C,5,0.2222222222222222,"""

The question is asking what the best argument of the objector (the person opposing this evidence) would be.",0.8853,0.92,0.96,0.03467,0.0747
700,D,C,6,0.25925925925925924,The options are (A) through (D).,0.8853,0.901,0.935,0.01563,0.0498
700,D,C,7,0.2962962962962963,"First, I need to recall the rules about character evidence in criminal trials.",0.8853,0.891,0.9404,0.00586,0.05518
700,D,C,8,0.3333333333333333,"From what I remember, in criminal cases, a defendant can sometimes offer evidence of their good character to show that they're less likely to commit a crime.",0.8853,0.8657,0.8975,-0.01953,0.01221
700,D,C,9,0.37037037037037035,But there are rules about how this can be done.,0.8853,0.848,0.9277,-0.0371,0.04248
700,D,C,10,0.4074074074074074,Option A says character evidence isn't admissible.,0.8853,0.876,0.774,-0.00928,-0.1113
700,D,C,11,0.4444444444444444,"But I think that's not entirely true because the defendant can introduce evidence of good character, especially under Federal Rule of Evidence 405(a), which allows for specific instances of conduct.",0.8853,0.8784,0.8574,-0.006836,-0.02783
700,D,C,12,0.48148148148148145,So A might not be the best argument.,0.8853,0.917,0.9683,0.03174,0.083
700,D,C,13,0.5185185185185185,Option B says one incident doesn't prove character.,0.8853,0.614,0.3755,-0.2715,-0.51
700,D,C,14,0.5555555555555556,"That makes sense because a single act, even if it shows honesty, doesn't establish a consistent character.",0.8853,0.1702,0.966,-0.715,0.08057
700,D,C,15,0.5925925925925926,But I'm not sure if this is the strongest argument here.,0.8853,0.851,0.966,-0.03418,0.08057
700,D,C,16,0.6296296296296297,Option C says it's an impermissible way to prove character.,0.8853,0.7764,0.827,-0.1089,-0.0581
700,D,C,17,0.6666666666666666,I'm a bit confused about this.,0.8853,0.8438,0.9272,-0.0415,0.042
700,D,C,18,0.7037037037037037,"If the man is offering his past conduct as evidence of his good character, that should be permissible under the rules.",0.8853,0.8965,0.8115,0.01123,-0.0737
700,D,C,19,0.7407407407407407,So maybe C isn't the right choice.,0.8853,0.847,0.717,-0.0381,-0.1685
700,D,C,20,0.7777777777777778,Option D says the evidence is irrelevant.,0.8853,0.945,0.9927,0.05957,0.1074
700,D,C,21,0.8148148148148148,That's a strong argument because relevance is key in evidence law.,0.8853,0.987,0.9326,0.10156,0.04736
700,D,C,22,0.8518518518518519,"If the evidence doesn't connect to the crime charged, it's irrelevant.",0.8853,0.9907,0.9834,0.10547,0.09814
700,D,C,23,0.8888888888888888,"Here, the man's honesty during the campaign might not directly relate to whether he committed tax fraud.",0.8853,0.9966,0.988,0.1113,0.10254
700,D,C,24,0.9259259259259259,"Just because he was honest in one situation doesn't necessarily mean he's honest in another, especially regarding tax laws, which are a specific area.",0.8853,0.994,0.9883,0.1089,0.103
700,D,C,25,0.9629629629629629,"So, putting it all together, the best argument against admitting this evidence would be that it's irrelevant to the charge of tax fraud.",0.8853,1.0,0.9995,0.11475,0.11426
700,D,C,26,1.0,"Therefore, the answer should be D.",0.8853,1.0,0.9995,0.11475,0.11426
715,D,B,0,0.034482758620689655,"Okay, so I'm trying to figure out this question about what ""Land"" refers to.",0.1467,0.077,0.077,-0.0697,-0.0697
715,D,B,1,0.06896551724137931,"The options are (A) all productive resources, (B) all natural resources, (C) farmland only, and (D) real estate.",0.1467,0.0897,0.0871,-0.057,-0.05963
715,D,B,2,0.10344827586206896,"Hmm, I remember from my classes that land is one of the factors of production, but I'm not entirely sure about the exact definition here.",0.1467,0.0789,0.08264,-0.0678,-0.0641
715,D,B,3,0.13793103448275862,Let me break it down.,0.1467,0.04852,0.04117,-0.0982,-0.1056
715,D,B,4,0.1724137931034483,"First, productive resources usually refer to things like labor, capital, and land that contribute to producing goods and services.",0.1467,0.06113,0.03067,-0.0856,-0.1161
715,D,B,5,0.20689655172413793,"So, (A) all productive resources seems too broad because land isn't the only productive resource.",0.1467,0.0296,0.03403,-0.1171,-0.1127
715,D,B,6,0.2413793103448276,It's just one part of it.,0.1467,0.04053,0.03302,-0.1062,-0.1137
715,D,B,7,0.27586206896551724,"Next, (B) all natural resources.",0.1467,0.05988,0.03848,-0.08685,-0.1083
715,D,B,8,0.3103448275862069,"Natural resources include things like minerals, forests, water, etc.",0.1467,0.04416,0.02263,-0.10254,-0.1241
715,D,B,9,0.3448275862068966,"Land is definitely a natural resource, but does it encompass all of them?",0.1467,0.0227,0.02373,-0.124,-0.123
715,D,B,10,0.3793103448275862,"I think land specifically refers to the physical surface of the earth, not necessarily all natural resources.",0.1467,0.1227,0.08276,-0.02405,-0.06396
715,D,B,11,0.41379310344827586,"So, (B) might be too inclusive.",0.1467,0.1925,0.07965,0.04578,-0.0671
715,D,B,12,0.4482758620689655,Option (C) is farmland only.,0.1467,0.05606,0.057,-0.0907,-0.0897
715,D,B,13,0.4827586206896552,That doesn't sound right because land includes more than just areas used for farming.,0.1467,0.09314,0.1022,-0.0536,-0.04456
715,D,B,14,0.5172413793103449,"It's about the entire surface, including urban areas, forests, etc.",0.1467,0.1103,0.068,-0.03644,-0.07874
715,D,B,15,0.5517241379310345,Then there's (D) real estate.,0.1467,0.09485,0.1316,-0.05188,-0.01514
715,D,B,16,0.5862068965517241,"Real estate involves land and the buildings on it, like houses and commercial properties.",0.1467,0.05728,0.2289,-0.0895,0.08215
715,D,B,17,0.6206896551724138,But does land refer exclusively to real estate?,0.1467,0.0507,0.443,-0.09607,0.2964
715,D,B,18,0.6551724137931034,I don't think so because land can be unused or just the surface without any structures.,0.1467,0.0359,0.03775,-0.11084,-0.109
715,D,B,19,0.6896551724137931,"Wait, maybe I should think about the economic definition.",0.1467,0.05048,0.1169,-0.09625,-0.02985
715,D,B,20,0.7241379310344828,"In economics, land is considered a factor of production, specifically the natural resources that are used to produce goods.",0.1467,0.01306,0.01746,-0.1337,-0.1293
715,D,B,21,0.7586206896551724,"But in common language, when someone refers to land, they often mean the physical surface, including real estate.",0.1467,0.7275,0.901,0.581,0.754
715,D,B,22,0.7931034482758621,"But in some contexts, like in real estate terms, land is just the property without the buildings.",0.1467,0.59,0.776,0.443,0.629
715,D,B,23,0.8275862068965517,"So, if the question is asking in a general sense, ""Land refers to,"" it might be better to go with (D) real estate because that's a common usage.",0.1467,0.993,0.992,0.8467,0.8457
715,D,B,24,0.8620689655172413,"But I'm not entirely confident because in some contexts, land is broader than just real estate.",0.1467,0.965,0.8955,0.8184,0.749
715,D,B,25,0.896551724137931,"Alternatively, thinking about the factors of production, land is a specific type of resource, so (A) is too broad.",0.1467,0.97,0.84,0.823,0.6934
715,D,B,26,0.9310344827586207,"(B) is about natural resources, which is a category that includes land but also other things.",0.1467,0.943,0.1737,0.796,0.02698
715,D,B,27,0.9655172413793104,(C) is too narrow.,0.1467,0.95,0.4575,0.8037,0.3108
715,D,B,28,1.0,So maybe the answer is (D) real estate because it's the most specific and common term used for land in everyday language.,0.1467,0.996,0.994,0.8496,0.8477
746,B,A,0,0.06666666666666667,"Okay, so I need to figure out what the Puritans believed regarding religious freedom based on the provided quote.",0.4666,0.605,0.605,0.1384,0.1384
746,B,A,1,0.13333333333333333,The question is asking which group they extended the freedom to practice religion to.,0.4666,0.6475,0.7144,0.1809,0.2478
746,B,A,2,0.2,"The options are (A) Puritans only, (B) all Protestants only, (C) all Christians only, (D) all Jews and Christians only.",0.4666,0.6274,0.7656,0.1609,0.299
746,B,A,3,0.26666666666666666,"Looking at the passage, it's from Roger Williams, a Puritan leader.",0.4666,0.6523,0.641,0.1858,0.1746
746,B,A,4,0.3333333333333333,"He talks about the civil powers imposing religion, mentioning things like oaths, tithes, and marriage and burial practices.",0.4666,0.556,0.658,0.0896,0.1917
746,B,A,5,0.4,He seems critical of the state imposing religious practices on people.,0.4666,0.618,0.74,0.1516,0.2737
746,B,A,6,0.4666666666666667,"Puritans were a specific group within Protestantism, and they often sought to purify the Church of England.",0.4666,0.6094,0.617,0.1428,0.1506
746,B,A,7,0.5333333333333333,"However, they were quite restrictive in their views on religious tolerance.",0.4666,0.0752,0.1838,-0.3914,-0.2827
746,B,A,8,0.6,"They typically believed in religious freedom for themselves but were less tolerant of other groups, especially Catholics and Jews.",0.4666,0.03384,0.0495,-0.4326,-0.417
746,B,A,9,0.6666666666666666,"In the context of the 17th century, the Puritans in Massachusetts Bay Colony, for example, established a theocratic government where only Puritans could vote and hold office.",0.4666,0.01297,0.04724,-0.4536,-0.4194
746,B,A,10,0.7333333333333333,"Other Protestants, like Quakers or Baptists, were often persecuted or at least excluded from full participation.",0.4666,0.02122,0.1785,-0.4453,-0.288
746,B,A,11,0.8,Jews were also not granted religious freedom in this context.,0.4666,0.00609,0.0397,-0.4604,-0.4268
746,B,A,12,0.8666666666666667,"So, considering this, the Puritans likely extended religious freedom to themselves and possibly other Protestants who were similar to them, but not to Jews.",0.4666,0.9717,0.0407,0.505,-0.4258
746,B,A,13,0.9333333333333333,"Therefore, the most accurate answer would be (B) all Protestants only, but I'm a bit uncertain because sometimes their tolerance was limited even to other Protestants.",0.4666,0.917,0.8896,0.4504,0.423
746,B,A,14,1.0,"However, given the options, (B) seems the best fit.",0.4666,0.9873,0.989,0.5205,0.5225
768,C,D,0,0.047619047619047616,"Okay, so I'm trying to figure out this accounting question.",0.02487,0.03757,0.03757,0.012695,0.012695
768,C,D,1,0.09523809523809523,The question is about what an accountant is required to do prior to compiling financial statements for a nonissuer.,0.02487,0.03375,0.0545,0.00888,0.02963
768,C,D,2,0.14285714285714285,"The options are A, B, C, and D.",0.02487,0.04642,0.06793,0.02155,0.04306
768,C,D,3,0.19047619047619047,Let me break them down one by one.,0.02487,0.0476,0.03833,0.02274,0.01346
768,C,D,4,0.23809523809523808,"First, I remember that compiling financial statements involves gathering information and presenting it in a structured format.",0.02487,0.06104,0.044,0.03616,0.01913
768,C,D,5,0.2857142857142857,But what exactly does the accountant need to do before starting this process?,0.02487,0.05283,0.0502,0.02795,0.02533
768,C,D,6,0.3333333333333333,Option A says the accountant must verify that the financial information agrees with the books of original entry.,0.02487,0.05463,0.0532,0.02975,0.02832
768,C,D,7,0.38095238095238093,"That sounds like part of the verification process, maybe during the audit or review, but I'm not sure if it's the first step before compiling.",0.02487,0.04227,0.03864,0.0174,0.01376
768,C,D,8,0.42857142857142855,It feels more like a step during the compilation rather than prior to it.,0.02487,0.0468,0.0503,0.02194,0.02542
768,C,D,9,0.47619047619047616,Option B mentions performing preliminary analytical procedures to identify specific risks.,0.02487,0.03262,0.03,0.00775,0.005127
768,C,D,10,0.5238095238095238,"Analytical procedures are definitely part of the audit process, but I'm not certain if they're required before compiling the financial statements.",0.02487,0.0545,0.0583,0.02963,0.03342
768,C,D,11,0.5714285714285714,"Maybe they're done during the planning phase, but I'm not sure if that's the primary step here.",0.02487,0.0654,0.1627,0.04056,0.1378
768,C,D,12,0.6190476190476191,Option C talks about making inquiries of management about their procedures for adjusting and closing the books.,0.02487,0.3108,0.8174,0.286,0.7925
768,C,D,13,0.6666666666666666,This makes sense because understanding how the entity handles its book-closing process is crucial.,0.02487,0.9077,0.947,0.883,0.922
768,C,D,14,0.7142857142857143,"If the accountant knows how management adjusts entries and closes the books, they can better compile the financial statements accurately.",0.02487,0.984,0.9595,0.959,0.9346
768,C,D,15,0.7619047619047619,This seems like a foundational step before starting the compilation.,0.02487,0.9927,0.9844,0.968,0.9595
768,C,D,16,0.8095238095238095,Option D is about understanding specialized frameworks in the entity's industry.,0.02487,0.913,0.9033,0.888,0.8784
768,C,D,17,0.8571428571428571,"While this is important, especially for entities in unique sectors, I think it's more about the overall environment rather than the immediate next step before compiling.",0.02487,0.9854,0.992,0.9604,0.9673
768,C,D,18,0.9047619047619048,It might be part of the initial planning but not necessarily the first action.,0.02487,0.987,0.969,0.962,0.9443
768,C,D,19,0.9523809523809523,"Putting it all together, the most logical first step is to inquire with management about their book procedures, which is Option C.",0.02487,0.9995,0.998,0.9746,0.973
768,C,D,20,1.0,This ensures the accountant has the necessary information to proceed accurately.,0.02487,0.9995,0.719,0.9746,0.6943
804,B,D,0,0.0625,"Alright, so I'm trying to figure out which answer is correct for the question about the Voting Rights Act of 1965.",0.8726,0.8613,0.8613,-0.01123,-0.01123
804,B,D,1,0.125,"The options are A, B, C, and D.",0.8726,0.698,0.695,-0.1743,-0.1777
804,B,D,2,0.1875,Let's break it down.,0.8726,0.7373,0.8354,-0.1353,-0.0371
804,B,D,3,0.25,"First, I know that the Voting Rights Act is a significant piece of legislation in the United States, primarily aimed at addressing voting discrimination.",0.8726,0.819,0.8906,-0.0537,0.01807
804,B,D,4,0.3125,It was enacted to overcome legal barriers that prevented African Americans from exercising their right to vote.,0.8726,0.4321,0.836,-0.4404,-0.03662
804,B,D,5,0.375,"Looking at the options:

A) Granted women the right to vote: I remember that women's suffrage was achieved through the 19th Amendment to the Constitution, which was passed in 1920.",0.8726,0.605,0.8457,-0.2676,-0.02686
804,B,D,6,0.4375,"So this doesn't seem right because the Voting Rights Act of 1965 is about voting rights for African Americans, not women.",0.8726,0.593,0.7563,-0.2798,-0.1162
804,B,D,7,0.5,B) Banned race-based discrimination: This sounds plausible because the Act was designed to eliminate racial discrimination in voting.,0.8726,0.951,0.9805,0.0786,0.1079
804,B,D,8,0.5625,It targeted practices like voter registration requirements that were used to disenfranchise African Americans.,0.8726,0.9756,0.9644,0.103,0.0918
804,B,D,9,0.625,"C) Granted African-Americans the right to vote: While the Act did increase access for African Americans, it's important to note that the right to vote for African Americans was already established by the 15th Amendment in 1870.",0.8726,0.847,0.8833,-0.02539,0.01074
804,B,D,10,0.6875,The Act was more about enforcement and eliminating obstacles rather than granting the right anew.,0.8726,0.9243,0.9272,0.05176,0.0547
804,B,D,11,0.75,D) Suspended the use of literacy tests at voting centers: Literacy tests were a tool used to prevent African Americans from voting.,0.8726,0.8784,0.928,0.00586,0.05566
804,B,D,12,0.8125,"The Voting Rights Act did indeed suspend their use, but it wasn't the primary purpose of the Act.",0.8726,0.975,0.9565,0.10254,0.084
804,B,D,13,0.875,It was part of several provisions aimed at ensuring equal access to voting.,0.8726,0.9736,0.929,0.1011,0.05664
804,B,D,14,0.9375,"So, the Act's main purpose was to ban racial discrimination in voting practices, which makes option B the most accurate.",0.8726,1.0,0.999,0.1274,0.1265
804,B,D,15,1.0,"While D is correct in a specific provision, the broader answer is B.",0.8726,0.9995,0.9966,0.127,0.124
819,C,B,0,0.034482758620689655,"Alright, so I need to figure out which of the given options is the odd one out when it comes to security threats faced by weak states.",0.11847,0.2257,0.2257,0.10724,0.10724
819,C,B,1,0.06896551724137931,"The options are A, B, C, and D.",0.11847,0.2128,0.1172,0.0943,-0.001282
819,C,B,2,0.10344827586206896,Let me go through each one and see how they relate to the concept of weak states.,0.11847,0.2491,0.09875,0.1306,-0.01971
819,C,B,3,0.13793103448275862,"First, I should understand what a weak state is.",0.11847,0.2435,0.1493,0.125,0.03082
819,C,B,4,0.1724137931034483,"From what I remember, a weak state is one that lacks the capacity to effectively govern its territory, enforce laws, maintain order, and protect its citizens.",0.11847,0.2001,0.1873,0.0816,0.0688
819,C,B,5,0.20689655172413793,This weakness can make them more vulnerable to various security threats.,0.11847,0.1741,0.3596,0.0556,0.2412
819,C,B,6,0.2413793103448276,Looking at option A: Warlordism and the influence of criminal gangs.,0.11847,0.435,0.4443,0.3167,0.326
819,C,B,7,0.27586206896551724,"I think this is a common issue in weak states because without strong governance, criminal elements can take over areas, leading to lawlessness.",0.11847,0.5103,0.3643,0.3918,0.2458
819,C,B,8,0.3103448275862069,So this fits as a typical security threat.,0.11847,0.6157,0.7407,0.4973,0.622
819,C,B,9,0.3448275862068966,Option B: A sudden influx of refugees.,0.11847,0.4177,0.06946,0.2993,-0.049
819,C,B,10,0.3793103448275862,Weak states might struggle to handle refugee flows because they don't have the resources to provide for large numbers of displaced people.,0.11847,0.4805,0.0909,0.362,-0.02759
819,C,B,11,0.41379310344827586,"This can strain their already limited infrastructure and social services, making it a plausible threat.",0.11847,0.619,0.1942,0.5005,0.07574
819,C,B,12,0.4482758620689655,Option C: Coup d'état or military rebellion.,0.11847,0.526,0.986,0.4075,0.867
819,C,B,13,0.4827586206896552,This is interesting.,0.11847,0.6157,0.359,0.4973,0.2405
819,C,B,14,0.5172413793103449,Coups are when the military overthrows the government.,0.11847,0.566,0.9087,0.4475,0.79
819,C,B,15,0.5517241379310345,"In weak states, where the military might be stronger than the civilian government, coups are a significant threat.",0.11847,0.6333,0.9517,0.5146,0.833
819,C,B,16,0.5862068965517241,It's a direct challenge to the state's authority and stability.,0.11847,0.5176,0.1262,0.3992,0.00775
819,C,B,17,0.6206896551724138,Option D: Competition for power or coercion from strongmen.,0.11847,0.2773,0.02727,0.1589,-0.0912
819,C,B,18,0.6551724137931034,This seems to refer to situations where individuals or groups within the state compete for control using force or threats.,0.11847,0.3093,0.1277,0.1909,0.00922
819,C,B,19,0.6896551724137931,"In weak states, this is also a prevalent issue because there's less effective governance to prevent such competitions.",0.11847,0.5273,0.1436,0.409,0.02509
819,C,B,20,0.7241379310344828,"Now, I need to determine which one is the odd one out.",0.11847,0.5293,0.1826,0.411,0.06415
819,C,B,21,0.7586206896551724,"Let's analyze each:

- A, B, and D all relate to internal threats: either from non-state actors (criminal gangs, warlords) or from competition among powerful individuals within the state.",0.11847,0.9297,0.02936,0.811,-0.0891
819,C,B,22,0.7931034482758621,These are all internal security issues that weak states commonly face.,0.11847,0.954,0.4412,0.8354,0.3228
819,C,B,23,0.8275862068965517,"- C, on the other hand, is about the military rebelling or overthrowing the government.",0.11847,0.972,0.844,0.8535,0.7256
819,C,B,24,0.8620689655172413,"While this is also an internal threat, it's specifically from the state's own military forces.",0.11847,0.961,0.9893,0.8423,0.8706
819,C,B,25,0.896551724137931,This is different because it's not about external actors or competition among non-state entities but about the failure of the state's institutions themselves.,0.11847,0.989,0.9805,0.87,0.862
819,C,B,26,0.9310344827586207,"So, the odd one out would be C because it's more about the state's own military failing rather than external or other internal actors.",0.11847,0.999,0.971,0.8804,0.8525
819,C,B,27,0.9655172413793104,"The other options involve threats from outside the state's formal structures or competition among different groups, not the military directly overthrowing the government.",0.11847,0.999,0.9976,0.8804,0.879
819,C,B,28,1.0,"Therefore, the best answer is: (C).",0.11847,0.999,0.9893,0.8804,0.8706
827,A,D,0,0.058823529411764705,"Okay, so I need to figure out what the core of the absolutist position is according to Nagel.",0.318,0.3186,0.3186,0.0004883,0.0004883
827,A,D,1,0.11764705882352941,"The options are A, B, C, D.",0.318,0.1841,0.1871,-0.134,-0.131
827,A,D,2,0.17647058823529413,Let's break this down.,0.318,0.1764,0.3503,-0.1417,0.03223
827,A,D,3,0.23529411764705882,"First, I remember that absolutist positions in ethics often refer to a view where certain moral principles are considered to be absolutely binding, regardless of the situation.",0.318,0.163,0.2373,-0.1552,-0.0808
827,A,D,4,0.29411764705882354,"For example, some might say that killing is always wrong, no matter the circumstances.",0.318,0.3367,0.7246,0.01855,0.4065
827,A,D,5,0.35294117647058826,"Looking at the options, option A says ""human persons have a right to life.",0.318,0.8916,0.948,0.573,0.63
827,A,D,6,0.4117647058823529,""" That sounds like a strong moral principle, something that an absolutist might support.",0.318,0.9795,0.951,0.661,0.633
827,A,D,7,0.47058823529411764,"It suggests that no matter what, human life is protected.",0.318,0.9883,0.985,0.67,0.667
827,A,D,8,0.5294117647058824,Option B is about permissible harm as a foreseen but unintended consequence.,0.318,0.9253,0.714,0.6074,0.3958
827,A,D,9,0.5882352941176471,"That sounds more like a consequentialist view, where the morality of an action is based on the outcomes.",0.318,0.9277,0.5874,0.6094,0.2693
