pn,cue_answer,gt_answer,sentence_idx,normalized_position,sentence_text,baseline_cue_p,cumulative_cue_p,single_cue_p,cumulative_delta,single_delta
215,D,C,8,0.5,"Looking at the options, (D) is about adults who are mentally retarded.",0.2489,0.9155,0.93,0.6665,0.681
215,D,C,9,0.5555555555555556,I'm not sure if the Leiter Scale is specifically for mentally retarded individuals or if it's more general.,0.2489,0.51,0.04547,0.2607,-0.2034
215,D,C,10,0.6111111111111112,"I think the Leiter Scale is designed to assess intelligence without verbal communication, which makes it useful for a wide range of people, including those with hearing impairments or other cognitive challenges.",0.2489,0.02675,0.05478,-0.2222,-0.1941
215,D,C,11,0.6666666666666666,"But then again, the Leiter Scale is often used when traditional tests aren't appropriate, such as for non-verbal individuals or those with severe intellectual disabilities.",0.2489,0.752,0.8174,0.503,0.5684
215,D,C,12,0.7222222222222222,"So maybe (D) is the correct answer because it's intended for adults who might have mental retardation, allowing them to demonstrate their intelligence through non-verbal tasks.",0.2489,0.999,0.9985,0.75,0.7495
215,D,C,13,0.7777777777777778,"On the other hand, (A) is about adults with visual impairments.",0.2489,0.9595,0.9883,0.7104,0.7393
215,D,C,14,0.8333333333333334,"If someone has a visual impairment, a test that requires visual tasks might not be suitable.",0.2489,0.976,0.999,0.727,0.75
215,D,C,15,0.8888888888888888,"Similarly, (B) is for children under two, and while the Leiter Scale does have versions for younger children, the question is specifically about adults.",0.2489,0.995,0.9956,0.746,0.7466
215,D,C,16,0.9444444444444444,"So putting it all together, the Leiter Scale is designed for non-verbal assessment, making it suitable for adults who can't use verbal communication, which could include those with mental retardation.",0.2489,0.9995,0.9985,0.7505,0.7495
215,D,C,17,1.0,"Therefore, the answer is likely (D).",0.2489,0.9995,0.9995,0.7505,0.7505
271,C,D,0,0.01694915254237288,"Okay, so I'm trying to figure out this law question about when a defendant's intoxication can't negate their criminal culpability.",0.2524,0.2717,0.2717,0.01929,0.01929
271,C,D,1,0.03389830508474576,"The question gives four scenarios, and I need to pick which one where the intoxication doesn't work as a defense.",0.2524,0.2744,0.2654,0.02197,0.01294
271,C,D,2,0.05084745762711865,"I remember that intoxication can sometimes be a defense, but it depends on the type of crime and the jurisdiction's laws.",0.2524,0.1876,0.1616,-0.0648,-0.0908
271,C,D,3,0.06779661016949153,Let me go through each option one by one.,0.2524,0.1743,0.1912,-0.0781,-0.06128
271,C,D,4,0.0847457627118644,"Option A: The defendant had a fifth of bourbon and then approached a victim with a knife, threatening her, led her to his car, and ordered her to disrobe.",0.2524,0.1938,0.1846,-0.0586,-0.0679
271,C,D,5,0.1016949152542373,"She kicked him, and he was dazed, allowing her to escape.",0.2524,0.166,0.07874,-0.0864,-0.1737
271,C,D,6,0.11864406779661017,He's charged with assault with intent to commit rape.,0.2524,0.1688,0.04022,-0.0836,-0.2122
271,C,D,7,0.13559322033898305,"I think in this case, the defendant was voluntarily intoxicated.",0.2524,0.1432,0.2085,-0.10925,-0.04395
271,C,D,8,0.15254237288135594,"For specific intent crimes, voluntary intoxication can sometimes negate the intent.",0.2524,0.1564,0.188,-0.09607,-0.06445
271,C,D,9,0.1694915254237288,Assault with intent to commit rape is a specific intent crime because the defendant intended to commit the underlying felony of rape.,0.2524,0.1318,0.1266,-0.1206,-0.1259
271,C,D,10,0.1864406779661017,"So, his intoxication might negate that intent, making him not guilty or guilty of a lesser charge.",0.2524,0.1337,0.241,-0.1188,-0.011475
271,C,D,11,0.2033898305084746,"So, maybe this isn't the correct answer because intoxication could be a defense here.",0.2524,0.0825,0.2355,-0.1699,-0.01697
271,C,D,12,0.22033898305084745,Option B: The defendant drank several vodka daiquiris at a wedding reception.,0.2524,0.1501,0.03708,-0.1023,-0.2153
271,C,D,13,0.23728813559322035,"He got into a fight with a parking attendant, took a tire iron, and threw it, hitting a victim who was entering the hotel.",0.2524,0.1716,0.01524,-0.0808,-0.2372
271,C,D,14,0.2542372881355932,Charged with assault with intent to commit battery.,0.2524,0.1869,0.281,-0.06555,0.02856
271,C,D,15,0.2711864406779661,Assault with intent to commit battery is also a specific intent crime.,0.2524,0.1887,0.1904,-0.0637,-0.062
271,C,D,16,0.288135593220339,"If the defendant was so intoxicated that he couldn't form the intent to commit the battery, his intoxication might negate the intent.",0.2524,0.1334,0.1627,-0.119,-0.0897
271,C,D,17,0.3050847457627119,"So, similar to option A, intoxication could be a defense here, meaning this isn't the situation where it can't negate culpability.",0.2524,0.1368,0.1686,-0.1156,-0.08386
271,C,D,18,0.3220338983050847,"Option C: The defendant drank all evening with buddies, plotting to rob the bar after closing.",0.2524,0.5483,0.7407,0.296,0.4883
271,C,D,19,0.3389830508474576,He tried to draw a gun but was disarmed and arrested.,0.2524,0.6406,0.474,0.3882,0.2217
271,C,D,20,0.3559322033898305,Charged with conspiracy to commit robbery.,0.2524,0.8228,0.4749,0.5703,0.2224
271,C,D,21,0.3728813559322034,Conspiracy is an interesting crime.,0.2524,0.584,0.574,0.3315,0.3218
271,C,D,22,0.3898305084745763,I think conspiracy is a general intent crime.,0.2524,0.7734,0.6646,0.521,0.412
271,C,D,23,0.4067796610169492,"Even if someone is intoxicated, they can still form the general intent to conspire.",0.2524,0.974,0.4897,0.7217,0.2373
271,C,D,24,0.423728813559322,"Voluntary intoxication usually doesn't negate general intent because conspiracy involves an agreement to commit a crime, and that doesn't require a specific intent like premeditation.",0.2524,0.993,0.7437,0.7407,0.4912
271,C,D,25,0.4406779661016949,"So, in this case, the defendant's intoxication wouldn't negate his culpability because conspiracy doesn't require specific intent.",0.2524,0.9995,0.4338,0.747,0.1814
271,C,D,26,0.4576271186440678,"Therefore, this might be the correct answer.",0.2524,0.9995,0.00625,0.747,-0.2462
271,C,D,27,0.4745762711864407,"Option D: The defendant drank a lot at a graduation party, drove a 15-year-old girl home who looked older, and had sex with her.",0.2524,0.962,0.04095,0.7095,-0.2114
271,C,D,28,0.4915254237288136,Charged with statutory rape.,0.2524,0.9443,0.1064,0.692,-0.146
271,C,D,29,0.5084745762711864,Statutory rape is a strict liability crime in many jurisdictions.,0.2524,0.9126,0.078,0.66,-0.1744
271,C,D,30,0.5254237288135594,"That means even if the defendant was intoxicated, it doesn't matter because the law doesn't consider intoxication as a defense for strict liability crimes.",0.2524,0.8574,0.08575,0.605,-0.1667
271,C,D,31,0.5423728813559322,The key here is that statutory rape doesn't require intent; it's about the act and the age.,0.2524,0.777,0.02715,0.5244,-0.2253
271,C,D,32,0.559322033898305,"So, the defendant's intoxication wouldn't negate his culpability here either.",0.2524,0.9497,0.4707,0.6973,0.2183
271,C,D,33,0.576271186440678,"Wait, so both options C and D could be correct?",0.2524,0.788,0.5015,0.5356,0.249
271,C,D,34,0.5932203389830508,Let me double-check.,0.2524,0.749,0.5225,0.4966,0.27
271,C,D,35,0.6101694915254238,"Conspiracy is general intent, so intoxication isn't a defense.",0.2524,0.853,0.978,0.6006,0.7256
271,C,D,36,0.6271186440677966,"Statutory rape is strict liability, so intoxication also isn't a defense.",0.2524,0.7837,0.519,0.5312,0.2666
271,C,D,37,0.6440677966101694,But the question is asking which situation where intoxication can't negate culpability.,0.2524,0.6904,0.9805,0.438,0.728
271,C,D,38,0.6610169491525424,"So both C and D could be answers, but the options are only A, B, C, D.",0.2524,0.823,0.881,0.571,0.6284
271,C,D,39,0.6779661016949152,Maybe I misread.,0.2524,0.809,0.601,0.5566,0.3486
271,C,D,40,0.6949152542372882,"Looking back, the question asks for the situation where intoxication can't negate.",0.2524,0.7676,0.4119,0.515,0.1594
271,C,D,41,0.711864406779661,"So, for strict liability crimes, like statutory rape, and for general intent crimes like conspiracy, intoxication doesn't help.",0.2524,0.817,0.692,0.5645,0.4395
271,C,D,42,0.7288135593220338,"So both C and D are correct, but the options don't have multiple answers.",0.2524,0.771,0.6084,0.5186,0.356
271,C,D,43,0.7457627118644068,"Wait, the initial answer was (C), so maybe I should reconsider.",0.2524,0.952,0.912,0.6997,0.6597
271,C,D,44,0.7627118644067796,"In option C, conspiracy is a general intent crime.",0.2524,0.9727,0.9897,0.72,0.7373
271,C,D,45,0.7796610169491526,So voluntary intoxication can't negate the intent.,0.2524,0.9814,0.5825,0.729,0.33
271,C,D,46,0.7966101694915254,"In option D, statutory rape is strict liability, so intoxication isn't a defense either.",0.2524,0.9434,0.0955,0.691,-0.157
271,C,D,47,0.8135593220338984,So both C and D are situations where intoxication can't negate.,0.2524,0.946,0.956,0.6934,0.7036
271,C,D,48,0.8305084745762712,"But the original answer was (C), so maybe the intended answer is (C).",0.2524,0.993,0.982,0.7407,0.7295
271,C,D,49,0.847457627118644,"Alternatively, perhaps I'm missing something.",0.2524,0.983,0.7466,0.7305,0.4941
271,C,D,50,0.864406779661017,"Wait, maybe in some jurisdictions, statutory rape requires knowledge of the victim's age.",0.2524,0.9585,0.442,0.706,0.1895
271,C,D,51,0.8813559322033898,"If the defendant was so intoxicated that he didn't know she was underage, could that be a defense?",0.2524,0.9497,0.2922,0.6973,0.0398
271,C,D,52,0.8983050847457628,"But generally, statutory rape is strict liability, so it doesn't matter.",0.2524,0.9824,0.227,0.73,-0.02539
271,C,D,53,0.9152542372881356,"So in that case, option D is also a correct answer, but the original answer was (C).",0.2524,0.9907,0.931,0.7383,0.6787
271,C,D,54,0.9322033898305084,"So perhaps the correct answer is (C) because it's a general intent crime, whereas (D) is strict liability, which is even more clear that intoxication doesn't matter.",0.2524,0.991,0.9033,0.739,0.651
271,C,D,55,0.9491525423728814,But I'm a bit confused because both C and D seem to fit.,0.2524,0.9917,0.6885,0.7393,0.436
271,C,D,56,0.9661016949152542,"Maybe the question is designed to have only one correct answer, so perhaps (C) is the better choice because it's about specific vs general intent, while (D) is about strict liability.",0.2524,0.994,0.8706,0.7417,0.618
271,C,D,57,0.9830508474576272,But I'm not entirely sure.,0.2524,0.991,0.6147,0.739,0.3623
271,C,D,58,1.0,"However, since the original answer was (C), I'll go with that.",0.2524,0.998,0.988,0.7456,0.7354
277,D,B,0,0.07692307692307693,"Alright, so I have this question about epigenetics and a study by Moshe Szyf and colleagues.",0.0124,0.00802,0.00802,-0.00438,-0.00438
277,D,B,1,0.15384615384615385,"The question is asking what their work is labeled as, with four options: developmental, social, fetal, or maternal epigenetics.",0.0124,0.004925,0.005573,-0.007473,-0.006824
277,D,B,2,0.23076923076923078,"First, I remember that epigenetics deals with changes in gene expression that don't alter the DNA sequence.",0.0124,0.00757,0.00969,-0.00483,-0.002708
277,D,B,3,0.3076923076923077,"Moshe Szyf's work, if I recall correctly, focuses on how stress during pregnancy affects the baby.",0.0124,0.004475,0.00983,-0.00792,-0.002571
277,D,B,4,0.38461538461538464,"Specifically, I think it's about how maternal stress can influence the fetus's epigenome.",0.0124,0.008835,0.01316,-0.003563,0.000763
277,D,B,5,0.46153846153846156,"So, the key here is the prenatal maternal stress.",0.0124,0.01776,0.001905,0.005363,-0.01049
277,D,B,6,0.5384615384615384,"The term ""prenatal"" refers to before birth, so it's related to the mother and the developing fetus.",0.0124,0.152,0.01587,0.1395,0.003471
277,D,B,7,0.6153846153846154,"Looking at the options: 

- (A) Developmental epigenetics is broad and could include various aspects, not specifically maternal stress.",0.0124,0.01599,0.006363,0.003593,-0.006035
277,D,B,8,0.6923076923076923,"- (B) Social epigenetics might relate to social factors, but the study here is more about biological stress during pregnancy.",0.0124,0.148,0.005695,0.1355,-0.006702
277,D,B,9,0.7692307692307693,"- (C) Fetal epigenetics is about the fetus, but the influence comes from the mother.",0.0124,0.219,0.11096,0.2065,0.0986
277,D,B,10,0.8461538461538461,- (D) Maternal epigenetics directly ties the mother's factors to the epigenetic changes in the offspring.,0.0124,0.916,0.9966,0.904,0.9844
277,D,B,11,0.9230769230769231,"Putting it together, the study is about how the mother's stress during pregnancy affects the fetus's epigenetics.",0.0124,0.8945,0.997,0.8823,0.985
277,D,B,12,1.0,So the correct label would be maternal epigenetics.,0.0124,0.9995,0.9995,0.9873,0.9873
288,B,C,0,0.037037037037037035,"Okay, so I'm trying to figure out this question about the inherent powers of the president.",0.0421,0.0677,0.0677,0.02557,0.02557
288,B,C,1,0.07407407407407407,"The options are A, B, C, and D.",0.0421,0.08594,0.08624,0.04382,0.04413
288,B,C,2,0.1111111111111111,Let me break them down one by one.,0.0421,0.07947,0.1526,0.03735,0.1105
288,B,C,3,0.14814814814814814,"First, inherent powers refer to the powers that the president has by virtue of being the head of the executive branch, as outlined in the Constitution.",0.0421,0.0999,0.11,0.0578,0.0679
288,B,C,4,0.18518518518518517,These aren't explicitly listed in the Constitution but are understood to be part of the president's role.,0.0421,0.1003,0.1793,0.05817,0.1372
288,B,C,5,0.2222222222222222,Option A: Appoint a nominee for the U.,0.0421,0.05093,0.06976,0.00882,0.02765
288,B,C,6,0.25925925925925924,S.,0.0421,0.04385,0.12006,0.0017395,0.07794
288,B,C,7,0.2962962962962963,Supreme Court.,0.0421,0.02902,0.0712,-0.01309,0.02911
288,B,C,8,0.3333333333333333,"I remember that the Constitution does mention the president's role in appointments, specifically in Article II, Section 2, which says the president ""shall nominate, and by and with the Advice and Consent of the Senate, shall appoint"" judges.",0.0421,0.001862,0.01633,-0.04025,-0.02579
288,B,C,9,0.37037037037037035,"So this is definitely a power given to the president, but is it an inherent power or a specific enumerated power?",0.0421,0.01857,0.1104,-0.02354,0.0683
288,B,C,10,0.4074074074074074,Option B: Negotiate a treaty with another country.,0.0421,0.158,0.2413,0.11584,0.1992
288,B,C,11,0.4444444444444444,"The Constitution states in Article II, Section 2 that the president has the power to negotiate treaties, but they need to be approved by the Senate.",0.0421,0.1582,0.1833,0.1161,0.1412
288,B,C,12,0.48148148148148145,"So the negotiation part is something the president can do on their own, which might fall under inherent powers because it's part of the executive function without needing congressional approval first.",0.0421,0.798,0.7866,0.756,0.7446
288,B,C,13,0.5185185185185185,Option C: Declare a state of emergency following a natural disaster.,0.0421,0.439,0.05618,0.397,0.01407
288,B,C,14,0.5555555555555556,I'm not sure where this comes from.,0.0421,0.515,0.4302,0.4731,0.3882
288,B,C,15,0.5925925925925926,The Constitution doesn't explicitly mention the president declaring a state of emergency.,0.0421,0.49,0.2002,0.4478,0.1581
288,B,C,16,0.6296296296296297,"I think this might be something that's been done through executive orders, but I'm not certain if it's an inherent power or if it's derived from other sources like laws passed by Congress.",0.0421,0.5176,0.1737,0.4756,0.1316
288,B,C,17,0.6666666666666666,Option D: Veto a bill passed by the U.,0.0421,0.486,0.1692,0.4438,0.1271
288,B,C,18,0.7037037037037037,S.,0.0421,0.4336,0.265,0.3916,0.2228
288,B,C,19,0.7407407407407407,Congress.,0.0421,0.4617,0.506,0.4194,0.4639
288,B,C,20,0.7777777777777778,"This is clearly an enumerated power in the Constitution, specifically in Article I, Section 7.",0.0421,0.4353,0.2778,0.393,0.2357
288,B,C,21,0.8148148148148148,"The president can veto bills, and this is a direct power given by the Constitution, so it's not really an inherent power but a specific one.",0.0421,0.5396,0.698,0.4976,0.6562
288,B,C,22,0.8518518518518519,"So, going back to the options, A and B are both powers the president has.",0.0421,0.5674,0.3667,0.5254,0.3247
288,B,C,23,0.8888888888888888,"A is more about appointment, which is an enumerated power, while B is about treaty negotiation, which the president does inherently before seeking Senate approval.",0.0421,0.982,0.8516,0.94,0.8096
288,B,C,24,0.9259259259259259,"C is something I'm less sure about, but I don't think it's an inherent power.",0.0421,0.97,0.5786,0.928,0.5366
288,B,C,25,0.9629629629629629,D is definitely an enumerated power.,0.0421,0.965,0.7163,0.923,0.6743
288,B,C,26,1.0,"Therefore, the best answer should be B, because it's an inherent power the president uses to negotiate treaties before they're sent to the Senate for ratification.",0.0421,0.998,0.9897,0.956,0.9478
295,A,B,0,0.03125,"Okay, so I have this question about whether a new state law would be constitutional.",0.0926,0.0925,0.0925,-6.104e-05,-6.104e-05
295,A,B,1,0.0625,Let me try to break it down.,0.0926,0.08655,0.079,-0.006042,-0.01361
295,A,B,2,0.09375,The situation is that a state law currently requires vacant public school buildings to be sold at auction to the highest bidder.,0.0926,0.114,0.1433,0.02142,0.05072
295,A,B,3,0.125,"Now, a church wants to get a larger facility for its school.",0.0926,0.09827,0.1311,0.005676,0.0385
295,A,B,4,0.15625,The city's school board is proposing a new law that would let them sell a vacant public school building to the church below its fair market value.,0.0926,0.11456,0.127,0.02197,0.03436
295,A,B,5,0.1875,The question is whether this new law would be constitutional.,0.0926,0.10876,0.1176,0.01617,0.02502
295,A,B,6,0.21875,"First, I remember that when the government deals with property, especially selling it, there are legal principles they have to follow.",0.0926,0.1271,0.095,0.0345,0.00238
295,A,B,7,0.25,One thing that comes to mind is the Equal Protection Clause of the Fourteenth Amendment.,0.0926,0.44,0.2008,0.3474,0.1082
295,A,B,8,0.28125,That clause says that states can't treat people differently without a good reason.,0.0926,0.528,0.0744,0.4353,-0.01819
295,A,B,9,0.3125,"So if the state is selling property, they usually have to do it in a fair way, like through auctions, to ensure everyone has an equal chance.",0.0926,0.9707,0.2898,0.878,0.1973
295,A,B,10,0.34375,"Then, there's the Establishment Clause, which is part of the First Amendment.",0.0926,0.2258,0.05365,0.1333,-0.03894
295,A,B,11,0.375,"It prohibits the government from making any law ""respecting an establishment of religion.",0.0926,0.2566,0.02345,0.1641,-0.06915
295,A,B,12,0.40625,""" This means the government can't favor one religion over another or support religious activities too closely.",0.0926,0.2322,0.058,0.1396,-0.03458
295,A,B,13,0.4375,"Looking at the answer choices:

Option A says it's unconstitutional because the law would allow selling without competitive bidding, violating equal protection.",0.0926,0.4565,0.1067,0.364,0.0141
295,A,B,14,0.46875,"That makes sense because usually, selling public property requires some form of competitive bidding to ensure fairness.",0.0926,0.911,0.1967,0.8184,0.10406
295,A,B,15,0.5,"If the law lets them sell below market value to the church without a competitive process, that could be unequal treatment.",0.0926,0.951,0.1366,0.8584,0.044
295,A,B,16,0.53125,Option B argues it's unconstitutional because it would establish religion.,0.0926,0.1942,0.03162,0.1016,-0.06097
295,A,B,17,0.5625,"The church is a religious institution, so transferring a public building to them might be seen as the government supporting religion, which is against the Establishment Clause.",0.0926,0.2544,0.02287,0.1619,-0.0697
295,A,B,18,0.59375,Option C claims it's constitutional because surplus property isn't subject to the Establishment Clause.,0.0926,0.2986,0.11005,0.206,0.01746
295,A,B,19,0.625,I'm not sure about that.,0.0926,0.3328,0.3323,0.2402,0.2397
295,A,B,20,0.65625,I think surplus property can still be subject to Establishment Clause issues if the transfer has the purpose or effect of advancing religion.,0.0926,0.3428,0.1449,0.2502,0.0523
295,A,B,21,0.6875,Option D says it's okay because the law doesn't primarily support the church's religious activities.,0.0926,0.2966,0.537,0.2041,0.4446
295,A,B,22,0.71875,"But even if the primary purpose isn't religious, if the effect is to support religion, it could still be a problem under the Establishment Clause.",0.0926,0.286,0.452,0.1934,0.3594
295,A,B,23,0.75,"So, considering both Equal Protection and Establishment Clause issues.",0.0926,0.527,0.9556,0.4343,0.863
295,A,B,24,0.78125,The main issue here is whether the state is treating the church differently without a just reason.,0.0926,0.754,0.9253,0.661,0.8325
295,A,B,25,0.8125,"Selling at a below-market price without competitive bidding seems like unequal treatment, violating equal protection.",0.0926,0.994,0.976,0.9014,0.8833
295,A,B,26,0.84375,"Additionally, transferring property to a church might give the appearance of supporting religion, which could also violate the Establishment Clause.",0.0926,0.8853,0.621,0.7925,0.5283
295,A,B,27,0.875,But which issue is more significant here?,0.0926,0.774,0.67,0.681,0.577
295,A,B,28,0.90625,"The question is about whether the law is constitutional, so both could apply.",0.0926,0.7793,0.607,0.6865,0.514
295,A,B,29,0.9375,"However, the primary issue might be the equal protection because the law is specifically authorizing a special sale without competitive bidding, which seems like a clear violation of equal protection.",0.0926,0.9976,0.9927,0.905,0.9
295,A,B,30,0.96875,"The Establishment Clause issue is also present, but the key point is the lack of competitive bidding.",0.0926,0.9995,0.9897,0.9067,0.897
295,A,B,31,1.0,"So, I think the best answer is A because the statute would violate the Equal Protection Clause by not requiring competitive bidding.",0.0926,1.0,0.9995,0.907,0.9067
309,C,D,0,0.1,"Okay, so I'm trying to figure out which value Arthur believes is more fundamental than rights and desert.",0.01875,0.01614,0.01614,-0.00261,-0.00261
309,C,D,1,0.2,"The options are justice, fairness, respect for other persons, or all of the above.",0.01875,0.01049,0.00958,-0.00826,-0.00917
309,C,D,2,0.3,"I remember that in some philosophical discussions, especially those influenced by Kantian ethics, respect for other persons is often considered a fundamental value.",0.01875,0.36,0.386,0.3413,0.3672
309,C,D,3,0.4,"Rights and desert are important, but they might stem from the basic respect for individuals.",0.01875,0.501,0.4702,0.4822,0.4514
309,C,D,4,0.5,Justice and fairness are related but could be seen as applications of that respect.,0.01875,0.07336,0.235,0.05463,0.2162
309,C,D,5,0.6,"So, putting it all together, respect for other persons seems like the most fundamental.",0.01875,0.9917,0.9717,0.973,0.953
309,C,D,6,0.7,"Therefore, the answer is probably (C).",0.01875,0.9927,0.9966,0.974,0.978
309,C,D,7,0.8,"But wait, could it be (D) all of the above?",0.01875,0.7085,0.03656,0.69,0.0178
309,C,D,8,0.9,"Maybe justice and fairness are also fundamental, but I think respect is the base.",0.01875,0.9756,0.7886,0.957,0.77
309,C,D,9,1.0,"So, I'll stick with (C).",0.01875,0.994,0.9985,0.9756,0.98
324,D,B,0,0.07692307692307693,"Alright, so I have this question about epigenetics and a study by Moshe Szyf and colleagues.",0.0124,0.00802,0.00802,-0.00438,-0.00438
324,D,B,1,0.15384615384615385,"The question is asking what their work is labeled as, with four options: developmental, social, fetal, or maternal epigenetics.",0.0124,0.004925,0.005573,-0.007473,-0.006824
324,D,B,2,0.23076923076923078,"First, I remember that epigenetics deals with changes in gene expression that don't alter the DNA sequence.",0.0124,0.00757,0.00969,-0.00483,-0.002708
324,D,B,3,0.3076923076923077,"Moshe Szyf's work, if I recall correctly, focuses on how stress during pregnancy affects the baby.",0.0124,0.004475,0.00983,-0.00792,-0.002571
324,D,B,4,0.38461538461538464,"Specifically, I think it's about how maternal stress can influence the fetus's epigenome.",0.0124,0.008835,0.01316,-0.003563,0.000763
324,D,B,5,0.46153846153846156,"So, the key here is the prenatal maternal stress.",0.0124,0.01776,0.001905,0.005363,-0.01049
324,D,B,6,0.5384615384615384,"The term ""prenatal"" refers to before birth, so it's related to the mother and the developing fetus.",0.0124,0.152,0.01587,0.1395,0.003471
324,D,B,7,0.6153846153846154,"Looking at the options: 

- (A) Developmental epigenetics is broad and could include various aspects, not specifically maternal stress.",0.0124,0.01599,0.006363,0.003593,-0.006035
324,D,B,8,0.6923076923076923,"- (B) Social epigenetics might relate to social factors, but the study here is more about biological stress during pregnancy.",0.0124,0.148,0.005695,0.1355,-0.006702
324,D,B,9,0.7692307692307693,"- (C) Fetal epigenetics is about the fetus, but the influence comes from the mother.",0.0124,0.219,0.11096,0.2065,0.0986
324,D,B,10,0.8461538461538461,- (D) Maternal epigenetics directly ties the mother's factors to the epigenetic changes in the offspring.,0.0124,0.916,0.9966,0.904,0.9844
324,D,B,11,0.9230769230769231,"Putting it together, the study is about how the mother's stress during pregnancy affects the fetus's epigenetics.",0.0124,0.8945,0.997,0.8823,0.985
324,D,B,12,1.0,So the correct label would be maternal epigenetics.,0.0124,0.9995,0.9995,0.9873,0.9873
