pn,cue_answer,gt_answer,sentence_idx,normalized_position,sentence_text,baseline_cue_p,cumulative_cue_p,single_cue_p,cumulative_delta,single_delta
339,C,A,0,0.06666666666666667,"Okay, so I'm trying to figure out whether Dr.",0.7246,0.753,0.753,0.02832,0.02832
339,C,A,1,0.13333333333333333,Penny Pincher's practice of billing clients' insurance companies for her full hourly fee when appointments are canceled less than 24 hours before is legal and ethical.,0.7246,0.8384,0.8467,0.1138,0.1221
339,C,A,2,0.2,"The options are (A) illegal and unethical, (B) illegal but ethical, (C) legal and ethical, and (D) legal but unethical.",0.7246,0.752,0.697,0.02734,-0.02783
339,C,A,3,0.26666666666666666,"First, I need to consider the legal aspect.",0.7246,0.7373,0.822,0.012695,0.09717
339,C,A,4,0.3333333333333333,I remember that healthcare providers often have policies regarding cancellations.,0.7246,0.733,0.9517,0.0083,0.227
339,C,A,5,0.4,"Typically, if a patient cancels an appointment with less than 24 hours' notice, the provider might charge a fee or bill the insurance company for the missed session.",0.7246,0.968,0.9927,0.2432,0.268
339,C,A,6,0.4666666666666667,I think this is common and probably allowed under the terms of the insurance contracts.,0.7246,0.9805,0.9863,0.2559,0.2617
339,C,A,7,0.5333333333333333,"So, legally, it might be okay.",0.7246,0.976,0.973,0.2515,0.2485
339,C,A,8,0.6,"Now, thinking about the ethical side.",0.7246,0.9604,0.9136,0.2358,0.189
339,C,A,9,0.6666666666666666,Is it ethical to bill for a service that wasn't provided?,0.7246,0.712,0.4734,-0.012695,-0.2512
339,C,A,10,0.7333333333333333,"Well, in the healthcare field, it's standard to have cancellation policies to manage their schedules and compensate for the lost time.",0.7246,0.983,0.9805,0.2583,0.2559
339,C,A,11,0.8,"If the client cancels last minute, the provider can't see another patient, so billing for the missed appointment helps cover the loss.",0.7246,0.987,0.9756,0.2622,0.251
339,C,A,12,0.8666666666666667,"This seems fair and reasonable, so ethically it might be justified.",0.7246,0.9985,0.998,0.274,0.2734
339,C,A,13,0.9333333333333333,"Putting it together, the practice is likely both legal and ethical.",0.7246,1.0,0.9995,0.2754,0.275
339,C,A,14,1.0,So the answer should be (C).,0.7246,1.0,1.0,0.2754,0.2754
340,C,B,0,0.024390243902439025,"Okay, so I'm trying to figure out how many times a day the Fatihah is recited.",0.21,0.2389,0.2389,0.02893,0.02893
340,C,B,1,0.04878048780487805,"The answer choices are (A) Exactly 17, (B) At least 17, (C) At least 13, and (D) Exactly 24.",0.21,0.3396,0.352,0.1296,0.1421
340,C,B,2,0.07317073170731707,"First, I need to understand what the Fatihah is.",0.21,0.316,0.1896,0.10596,-0.02039
340,C,B,3,0.0975609756097561,"From what I know, the Fatihah is the opening chapter of the Quran, Surah Al-Fatiha.",0.21,0.345,0.2024,0.135,-0.00757
340,C,B,4,0.12195121951219512,Muslims are required to recite it during each of their daily prayers.,0.21,0.2366,0.1611,0.02661,-0.04883
340,C,B,5,0.14634146341463414,"There are five daily prayers: Fajr, Dhuhr, Asr, Maghrib, and Isha.",0.21,0.3306,0.2086,0.1206,-0.001343
340,C,B,6,0.17073170731707318,So that's five times a day.,0.21,0.599,0.2174,0.3892,0.007446
340,C,B,7,0.1951219512195122,"But wait, during each prayer, how many times is the Fatihah recited?",0.21,0.5117,0.3083,0.3018,0.0984
340,C,B,8,0.21951219512195122,I think it's recited once at the beginning of each prayer.,0.21,0.5625,0.2432,0.3525,0.0332
340,C,B,9,0.24390243902439024,So that would be five times a day.,0.21,0.6436,0.3042,0.4336,0.09424
340,C,B,10,0.2682926829268293,But the answer choices don't include five.,0.21,0.6523,0.3232,0.4424,0.1133
340,C,B,11,0.2926829268292683,"Hmm, maybe I'm missing something.",0.21,0.7007,0.2374,0.4907,0.02747
340,C,B,12,0.3170731707317073,"Oh, right!",0.21,0.5503,0.2421,0.3403,0.0321
340,C,B,13,0.34146341463414637,The Fatihah is also recited in other contexts.,0.21,0.3518,0.1847,0.1418,-0.02527
340,C,B,14,0.36585365853658536,"For example, it's recited before each chapter of the Quran when reading the entire Quran.",0.21,0.3643,0.2915,0.1543,0.08154
340,C,B,15,0.3902439024390244,"So if someone reads the entire Quran in one day, they would recite the Fatihah 114 times (since there are 114 chapters).",0.21,0.2834,0.3477,0.0735,0.1377
340,C,B,16,0.4146341463414634,But that's a specific case and not part of the regular daily prayers.,0.21,0.5005,0.3833,0.2905,0.1733
340,C,B,17,0.43902439024390244,"Wait, but the question is about how many times it's recited in a day in general.",0.21,0.4102,0.3508,0.2002,0.1409
340,C,B,18,0.4634146341463415,So the daily prayers account for five times.,0.21,0.596,0.413,0.3862,0.2031
340,C,B,19,0.4878048780487805,Are there other times when it's recited?,0.21,0.5146,0.3525,0.3047,0.1426
340,C,B,20,0.5121951219512195,"For example, during certain supplications or rituals like the Sunnah prayers.",0.21,0.3816,0.4204,0.1716,0.2104
340,C,B,21,0.5365853658536586,Maybe the number is higher.,0.21,0.2944,0.359,0.0845,0.1489
340,C,B,22,0.5609756097560976,"I recall that in addition to the five daily prayers, there are optional Sunnah prayers.",0.21,0.3186,0.3499,0.10864,0.1399
340,C,B,23,0.5853658536585366,"For example, the Sunnah prayer after Dhuhr has four rakats, and the Fatihah is recited once in each rakat.",0.21,0.3171,0.3337,0.1072,0.1238
340,C,B,24,0.6097560975609756,So that would add four more recitations.,0.21,0.3188,0.3088,0.1089,0.0989
340,C,B,25,0.6341463414634146,"Similarly, there are other Sunnah prayers with multiple rakats.",0.21,0.2844,0.3125,0.07446,0.10254
340,C,B,26,0.6585365853658537,Let me try to add this up.,0.21,0.3284,0.3223,0.1184,0.1123
340,C,B,27,0.6829268292682927,"The five daily prayers (Fajr, Dhuhr, Asr, Maghrib, Isha) each require the Fatihah once, so that's five.",0.21,0.389,0.4844,0.179,0.2744
340,C,B,28,0.7073170731707317,"Then, the Sunnah prayers: 

- After Dhuhr (Dhuha), there are two Sunnah rakats, each with the Fatihah.",0.21,0.3987,0.366,0.1887,0.156
340,C,B,29,0.7317073170731707,So that's two more.,0.21,0.4346,0.3518,0.2246,0.1418
340,C,B,30,0.7560975609756098,"- After Asr, there are two Sunnah rakats.",0.21,0.3894,0.3442,0.1794,0.1343
340,C,B,31,0.7804878048780488,"- After Maghrib, there are two Sunnah rakats.",0.21,0.415,0.3574,0.2051,0.1475
340,C,B,32,0.8048780487804879,"- After Isha, there are two Sunnah rakats.",0.21,0.3857,0.409,0.1758,0.199
340,C,B,33,0.8292682926829268,"Wait, I think I might be confusing the number of Sunnah rakats.",0.21,0.3752,0.3613,0.1653,0.1514
340,C,B,34,0.8536585365853658,Let me check.,0.21,0.367,0.3416,0.157,0.1316
340,C,B,35,0.8780487804878049,"For Dhuha, it's two Sunnah rakats.",0.21,0.397,0.3792,0.187,0.1692
340,C,B,36,0.9024390243902439,"For each of the other prayers, it's two Sunnah each.",0.21,0.452,0.401,0.242,0.1909
340,C,B,37,0.926829268292683,So that's 2 (Dhuha) + 2 (Asr) + 2 (Maghrib) + 2 (Isha) = 8.,0.21,0.3967,0.4788,0.1868,0.2688
340,C,B,38,0.9512195121951219,"Adding that to the five Fard prayers, that's 13.",0.21,0.989,0.869,0.779,0.659
340,C,B,39,0.975609756097561,"So in total, the Fatihah is recited at least 13 times a day.",0.21,0.998,0.9795,0.788,0.7695
340,C,B,40,1.0,"Therefore, the correct answer should be (C) At least 13.",0.21,0.9995,0.992,0.7896,0.782
369,B,A,0,0.041666666666666664,"Okay, I'm trying to figure out which of these statements about assessing arm reflexes is true.",0.0927,0.08685,0.08685,-0.00586,-0.00586
369,B,A,1,0.08333333333333333,Let's go through each option one by one.,0.0927,0.085,0.08386,-0.00769,-0.00885
369,B,A,2,0.125,"Starting with option A: ""The root value of the biceps reflex is C5, C6.",0.0927,0.0897,0.0879,-0.00299,-0.00482
369,B,A,3,0.16666666666666666,""" I remember that the biceps reflex is related to the cervical spine.",0.0927,0.07404,0.06073,-0.01868,-0.03198
369,B,A,4,0.20833333333333334,The biceps muscle is innervated by the C5 and C6 nerve roots.,0.0927,0.003748,0.01179,-0.089,-0.08093
369,B,A,5,0.25,"So, this statement seems correct.",0.0927,0.000919,0.0527,-0.0918,-0.04
369,B,A,6,0.2916666666666667,"Option B says, ""If no reflex is elicited when you tap a tendon it is documented as absent.",0.0927,0.01772,0.1416,-0.075,0.0489
369,B,A,7,0.3333333333333333,""" In clinical practice, if a reflex isn't elicited, it's usually noted as 'absent' or sometimes 'blunted' if it's weaker than normal.",0.0927,0.0194,0.3179,-0.0733,0.2251
369,B,A,8,0.375,So this seems accurate too.,0.0927,0.1442,0.01659,0.05145,-0.0761
369,B,A,9,0.4166666666666667,"Option C: ""The triceps tendon is struck in the antecubital fossa.",0.0927,0.05966,0.0339,-0.03305,-0.0588
369,B,A,10,0.4583333333333333,""" The antecubital fossa is the area on the front of the elbow.",0.0927,0.05438,0.04114,-0.03833,-0.05157
369,B,A,11,0.5,"The triceps tendon is located at the back of the elbow, so tapping there wouldn't be in the antecubital fossa.",0.0927,0.0909,0.02977,-0.001831,-0.0629
369,B,A,12,0.5416666666666666,This statement seems incorrect.,0.0927,0.06946,0.06305,-0.02325,-0.02966
369,B,A,13,0.5833333333333334,"Option D: ""Brisk finger jerks confirm a lower motor neurone lesion.",0.0927,0.0566,0.0624,-0.0361,-0.0303
369,B,A,14,0.625,""" Lower motor neuron lesions typically cause hyperreflexia, which can present as brisk reflexes.",0.0927,0.0773,0.0648,-0.01544,-0.0279
369,B,A,15,0.6666666666666666,"However, brisk jerks alone aren't conclusive; they need to be considered alongside other clinical signs.",0.0927,0.0806,0.03784,-0.012085,-0.05487
369,B,A,16,0.7083333333333334,So this statement might not be entirely correct because it's not a definitive confirmation without more context.,0.0927,0.06036,0.04788,-0.03235,-0.04483
369,B,A,17,0.75,"So, looking back, both A and B seem correct.",0.0927,0.165,0.1304,0.0723,0.03766
369,B,A,18,0.7916666666666666,"But wait, the original answer was (B).",0.0927,0.9663,0.9497,0.8735,0.857
369,B,A,19,0.8333333333333334,Maybe I'm missing something.,0.0927,0.918,0.0479,0.825,-0.0448
369,B,A,20,0.875,Let me double-check.,0.0927,0.9087,0.0501,0.816,-0.0426
369,B,A,21,0.9166666666666666,"The triceps reflex is indeed tested by tapping the olecranon process, not the antecubital fossa, so C is definitely wrong.",0.0927,0.901,0.03387,0.808,-0.05884
369,B,A,22,0.9583333333333334,"For D, while brisk reflexes can suggest a lower motor lesion, they aren't a standalone confirmation.",0.0927,0.913,0.04587,0.8203,-0.04684
369,B,A,23,1.0,"So, the best answer is probably B because it's a straightforward fact about documentation.",0.0927,0.9946,0.995,0.902,0.9023
371,D,C,0,0.05555555555555555,"Okay, so I need to figure out which answer is correct for the question about Hare's assertion on the similarities between ethics and science.",0.931,0.9424,0.9424,0.01123,0.01123
371,D,C,1,0.1111111111111111,"The options are A, B, C, and D (all of the above).",0.931,0.9453,0.95,0.01416,0.01904
371,D,C,2,0.16666666666666666,"First, I'll try to understand what each option is saying.",0.931,0.9194,0.946,-0.01172,0.01465
371,D,C,3,0.2222222222222222,Option A says both ethics and science seek to provide true beliefs about the world.,0.931,0.9067,0.9473,-0.02441,0.01611
371,D,C,4,0.2777777777777778,That makes sense because science aims to discover truths about the universe through observation and experimentation.,0.931,0.9087,0.928,-0.02246,-0.00293
371,D,C,5,0.3333333333333333,"Ethics, on the other hand, deals with moral truths, like what's right or wrong.",0.931,0.8047,0.9326,-0.1265,0.001465
371,D,C,6,0.3888888888888889,"So, yes, both are about finding truths, just in different domains.",0.931,0.6816,0.7397,-0.2495,-0.1914
371,D,C,7,0.4444444444444444,Option B claims both are essential components of a worthwhile life.,0.931,0.9697,0.9707,0.03857,0.03955
371,D,C,8,0.5,Ethics definitely plays a role in guiding how we live and make decisions.,0.931,0.9526,0.974,0.02148,0.04297
371,D,C,9,0.5555555555555556,"Science contributes by advancing knowledge, which can improve our quality of life through technology and understanding.",0.931,0.9736,0.9585,0.04248,0.02734
371,D,C,10,0.6111111111111112,"So, both are important for a meaningful life, which seems correct.",0.931,0.9897,0.9795,0.0586,0.04834
371,D,C,11,0.6666666666666666,Option C states both involve testing general principles by examining their logical consequences.,0.931,0.9756,0.968,0.04443,0.03662
371,D,C,12,0.7222222222222222,"In science, theories are tested by their predictions and logical outcomes; if the consequences don't align with observations, the theory is revised.",0.931,0.983,0.965,0.05176,0.0337
371,D,C,13,0.7777777777777778,Ethics also involves testing principles by considering their logical outcomes.,0.931,0.992,0.9927,0.06104,0.06152
371,D,C,14,0.8333333333333334,"For example, a moral principle might be evaluated based on how it affects various situations and whether it leads to consistent and just outcomes.",0.931,0.996,0.9976,0.06494,0.0664
371,D,C,15,0.8888888888888888,"So, this seems accurate too.",0.931,0.9985,0.999,0.0674,0.0679
371,D,C,16,0.9444444444444444,"Putting it all together, each option A, B, and C seems to correctly describe similarities between ethics and science.",0.931,0.9995,0.9995,0.06836,0.06836
371,D,C,17,1.0,"Therefore, the best answer would be D, which includes all of the above.",0.931,1.0,1.0,0.06885,0.06885
375,B,A,0,0.07142857142857142,"Okay, I'm trying to figure out what Ashford's article is addressing.",0.755,0.8965,0.8965,0.1416,0.1416
375,B,A,1,0.14285714285714285,The options are A through D.,0.755,0.865,0.848,0.11035,0.09326
375,B,A,2,0.21428571428571427,Let me break down each choice.,0.755,0.8647,0.8765,0.10986,0.1216
375,B,A,3,0.2857142857142857,Option A talks about the sheer scope of global poverty.,0.755,0.8257,0.641,0.0708,-0.1138
375,B,A,4,0.35714285714285715,"That's a big issue, but I'm not sure if that's what Ashford is focusing on.",0.755,0.8457,0.75,0.0908,-0.004883
375,B,A,5,0.42857142857142855,He might be addressing a more specific problem.,0.755,0.9214,0.915,0.1665,0.1602
375,B,A,6,0.5,Option B is about choosing between immediate harm and structural injustice.,0.755,0.984,0.998,0.229,0.2432
375,B,A,7,0.5714285714285714,"This seems like a common ethical dilemma—whether to fix an immediate problem or tackle deeper, systemic issues.",0.755,0.9966,0.998,0.2417,0.2432
375,B,A,8,0.6428571428571429,That feels relevant.,0.755,0.998,0.9194,0.2432,0.1646
375,B,A,9,0.7142857142857143,Option C mentions reconciling conflicting moral theories.,0.755,0.9873,0.4512,0.2324,-0.3037
375,B,A,10,0.7857142857142857,That's a bit abstract and might be more about theoretical discussions rather than a practical paralysis.,0.755,0.996,0.932,0.2412,0.1772
375,B,A,11,0.8571428571428571,Option D refers to giving up wealth based on Singer's arguments.,0.755,0.9927,0.8457,0.2378,0.0908
375,B,A,12,0.9285714285714286,"Singer's utilitarian views are about giving as much as possible, but I'm not sure if that's the main issue Ashford is addressing.",0.755,0.998,0.9766,0.2432,0.2217
375,B,A,13,1.0,"Considering the options, B seems the most plausible because it's about a specific paralysis in decision-making between two important ethical concerns.",0.755,1.0,1.0,0.2451,0.2451
382,D,A,0,0.034482758620689655,"Okay, so I have this question about a theory built around the idea that people make choices based on their values and beliefs.",0.6396,0.7036,0.7036,0.06396,0.06396
382,D,A,1,0.06896551724137931,"The answer choices are Expectancy, Instrumental, Classical, and Contingency.",0.6396,0.64,0.5303,0.0004883,-0.1094
382,D,A,2,0.10344827586206896,"I'm not too familiar with all these theories, but I'll try to break it down.",0.6396,0.5947,0.505,-0.04492,-0.1348
382,D,A,3,0.13793103448275862,"First, I remember that in psychology and management, there are several theories about motivation and behavior.",0.6396,0.64,0.5713,0.0004883,-0.06836
382,D,A,4,0.1724137931034483,Let me think about each option.,0.6396,0.6885,0.3298,0.04883,-0.3098
382,D,A,5,0.20689655172413793,"Expectancy theory, I think, is about how people's motivation is influenced by their expectations of rewards.",0.6396,0.5776,0.1034,-0.062,-0.536
382,D,A,6,0.2413793103448276,It's more about the outcomes they expect from their actions.,0.6396,0.639,0.226,-0.0004883,-0.4136
382,D,A,7,0.27586206896551724,"So, it's not exactly about values and beliefs, but more about the expected results.",0.6396,0.7354,0.3071,0.0957,-0.3325
382,D,A,8,0.3103448275862069,"Instrumental theory, if I recall correctly, is related to learning through consequences.",0.6396,0.7266,0.1517,0.0869,-0.4878
382,D,A,9,0.3448275862068966,"It suggests that behavior is shaped by its outcomes, like rewards or punishments.",0.6396,0.7344,0.4766,0.0947,-0.1631
382,D,A,10,0.3793103448275862,"So, this is more about cause and effect rather than internal values guiding choices.",0.6396,0.8145,0.503,0.1748,-0.1367
382,D,A,11,0.41379310344827586,"Classical theory might refer to classical conditioning, which is about associating stimuli with responses, like Pavlov's dogs.",0.6396,0.8506,0.9663,0.2109,0.3267
382,D,A,12,0.4482758620689655,"That doesn't seem to fit because it's about automatic responses, not choices based on values.",0.6396,0.748,0.97,0.1084,0.3306
382,D,A,13,0.4827586206896552,"Contingency theory, now, I'm a bit fuzzy on.",0.6396,0.877,0.999,0.2373,0.3594
382,D,A,14,0.5172413793103449,I think it's about how leaders adapt their behavior based on the situation.,0.6396,0.908,1.0,0.2686,0.3604
382,D,A,15,0.5517241379310345,"But wait, the question is about people making choices based on their own values and beliefs, not necessarily about leadership styles.",0.6396,0.7485,0.995,0.1089,0.3555
382,D,A,16,0.5862068965517241,"Wait, maybe I'm mixing up the theories.",0.6396,0.6514,0.998,0.01172,0.3584
382,D,A,17,0.6206896551724138,"Another thought: there's also the Theory of Planned Behavior, which is about how attitudes, subjective norms, and perceived behavioral control influence intentions and behavior.",0.6396,0.7,0.9985,0.06055,0.359
382,D,A,18,0.6551724137931034,But that's not one of the options here.,0.6396,0.791,0.9707,0.1514,0.331
382,D,A,19,0.6896551724137931,"Alternatively, the question might be referring to something else.",0.6396,0.762,0.9985,0.12256,0.359
382,D,A,20,0.7241379310344828,"Maybe it's not a well-known theory, but I think Contingency theory could relate to how individuals choose behaviors based on what they think is appropriate in a situation, which might tie into their values and beliefs.",0.6396,0.9946,0.9995,0.355,0.3599
382,D,A,21,0.7586206896551724,"Wait, but I'm not entirely sure.",0.6396,0.9614,0.999,0.3218,0.3594
382,D,A,22,0.7931034482758621,Let me think again.,0.6396,0.9526,0.9995,0.313,0.3599
382,D,A,23,0.8275862068965517,"Expectancy is about outcomes, Instrumental about consequences, Classical about associations.",0.6396,0.945,1.0,0.3052,0.3604
382,D,A,24,0.8620689655172413,"Contingency is more about adapting to situations, perhaps based on internal factors like values.",0.6396,0.981,1.0,0.3413,0.3604
382,D,A,25,0.896551724137931,"Hmm, I'm still a bit confused.",0.6396,0.936,0.9976,0.2964,0.358
382,D,A,26,0.9310344827586207,Maybe the answer is (D) Contingency because it involves considering the situation and personal factors like values when making decisions.,0.6396,0.997,1.0,0.3574,0.3604
382,D,A,27,0.9655172413793104,Or perhaps it's (A) Expectancy because it's about expectations based on values.,0.6396,0.84,0.802,0.2002,0.1621
382,D,A,28,1.0,"I'm not entirely confident, but based on the initial thought, I think Contingency might be the intended answer.",0.6396,0.994,0.9995,0.3545,0.3599
399,A,B,0,0.06666666666666667,"Okay, so I need to figure out which factor has the strongest influence on learning in people with antisocial personalities.",0.313,0.3503,0.3503,0.03735,0.03735
399,A,B,1,0.13333333333333333,"The options are social ostracism, money, tranquilizers, and physical punishment.",0.313,0.601,0.5713,0.288,0.2583
399,A,B,2,0.2,"I'm not entirely sure, but I'll try to break it down.",0.313,0.6343,0.6094,0.3213,0.2964
399,A,B,3,0.26666666666666666,"First, antisocial personality traits are often associated with behaviors like deceitfulness, manipulation, and a disregard for social norms.",0.313,0.6494,0.55,0.3364,0.2368
399,A,B,4,0.3333333333333333,"People with these traits might struggle with learning, especially if learning environments are structured in ways that require cooperation, empathy, or adherence to rules.",0.313,0.7983,0.7524,0.4854,0.4395
399,A,B,5,0.4,"Looking at the options:

A) Social ostracism: This is being excluded or ignored by others.",0.313,0.8984,0.969,0.5854,0.6562
399,A,B,6,0.4666666666666667,Antisocial individuals might already feel detached or distrustful.,0.313,0.9194,0.993,0.6064,0.68
399,A,B,7,0.5333333333333333,"If they're ostracized, it could worsen their willingness to engage in learning, maybe making them more resistant.",0.313,0.971,0.9985,0.658,0.6855
399,A,B,8,0.6,"B) Money: Financial incentives might influence behavior, but antisocial personalities might be more motivated by immediate gains rather than long-term learning.",0.313,0.8613,0.99,0.5483,0.6772
399,A,B,9,0.6666666666666666,I'm not sure how effective money is here.,0.313,0.864,0.9863,0.551,0.6733
399,A,B,10,0.7333333333333333,"C) Tranquilizers: These could reduce anxiety or hyperactivity, which might help focus.",0.313,0.7725,0.986,0.4595,0.673
399,A,B,11,0.8,"But antisocial traits might not stem from such issues, so the effect might be limited.",0.313,0.9116,0.995,0.5986,0.682
399,A,B,12,0.8666666666666667,"D) Physical punishment: This could lead to fear or resentment, which might actually increase antisocial behaviors rather than improve learning.",0.313,0.9688,0.998,0.656,0.685
399,A,B,13,0.9333333333333333,"I'm leaning towards social ostracism because antisocial individuals might avoid learning if they feel excluded, which could reinforce their negative behaviors.",0.313,0.998,0.9995,0.685,0.6865
399,A,B,14,1.0,They might see no point in engaging if others are pushing them away.,0.313,0.999,0.991,0.686,0.678
408,C,B,0,0.06666666666666667,"Okay, so I'm trying to figure out which of these statements about the consequences of an adaptive metabolic demand on protein requirements is correct.",0.09,0.1199,0.1199,0.02985,0.02985
408,C,B,1,0.13333333333333333,"I remember from my studies that nitrogen balance studies are used to determine protein requirements, but I'm a bit fuzzy on how adaptation plays into this.",0.09,0.1094,0.10657,0.01935,0.01654
408,C,B,2,0.2,"First, let's break down each option:

Option A says adaptation is fully accounted for in nitrogen balance studies.",0.09,0.08307,0.1483,-0.006958,0.0583
408,C,B,3,0.26666666666666666,I don't think that's right.,0.09,0.0718,0.1981,-0.01825,0.1081
408,C,B,4,0.3333333333333333,"Adaptation can vary between individuals and situations, and I don't recall studies fully accounting for all possible adaptations.",0.09,0.068,0.2343,-0.02203,0.1443
408,C,B,5,0.4,Option B claims that adaptive metabolic demand means the slope of N-balance studies underestimates protein efficiency.,0.09,0.0874,0.01333,-0.002625,-0.0767
408,C,B,6,0.4666666666666667,I'm not too sure about this.,0.09,0.1617,0.1581,0.0717,0.06805
408,C,B,7,0.5333333333333333,"The slope in N-balance studies usually reflects how much nitrogen is retained, but I'm not certain if adaptation would make this less efficient.",0.09,0.188,0.11426,0.09796,0.02423
408,C,B,8,0.6,Option C suggests variable adaptation between studies is accounted for by using EAR+2SD.,0.09,0.6787,0.7466,0.589,0.6567
408,C,B,9,0.6666666666666666,That sounds familiar.,0.09,0.9727,0.1201,0.883,0.03009
408,C,B,10,0.7333333333333333,"EAR is the Estimated Average Requirement, and 2SD accounts for variability.",0.09,0.98,0.482,0.89,0.3918
408,C,B,11,0.8,So maybe this is correct because it includes a buffer for different adaptations.,0.09,0.997,0.06433,0.907,-0.0257
408,C,B,12,0.8666666666666667,Option D says adaptation shouldn't influence N-balance interpretations.,0.09,0.9883,0.09875,0.8984,0.00873
408,C,B,13,0.9333333333333333,"That doesn't make sense because adaptation definitely affects how much protein is needed, so it must play a role.",0.09,0.9956,0.06085,0.906,-0.02917
408,C,B,14,1.0,"So, putting it together, the correct answer is likely C because it accounts for variability due to adaptation.",0.09,0.9995,0.9727,0.9097,0.883
418,C,A,0,0.014925373134328358,"Alright, so I'm trying to figure out this legal question about conspiracy and whether the defendant will be convicted or acquitted.",0.00926,0.00735,0.00735,-0.001911,-0.001911
418,C,A,1,0.029850746268656716,Let me break it down step by step.,0.00926,0.00809,0.007477,-0.001175,-0.001785
418,C,A,2,0.04477611940298507,"First, the scenario: The defendant approached her friend and offered $50 to beat up her ex-boyfriend.",0.00926,0.007206,0.00998,-0.002056,0.000717
418,C,A,3,0.05970149253731343,"They agreed, but the friend wanted to wait until the ex left the bar.",0.00926,0.00812,0.00792,-0.001144,-0.001343
418,C,A,4,0.07462686567164178,"Then, the defendant overheard her ex on the phone and found out he's a federal agent.",0.00926,0.00504,0.00496,-0.004223,-0.004303
418,C,A,5,0.08955223880597014,She told her friend not to go through with the plan because she's afraid of prosecution.,0.00926,0.005314,0.005524,-0.00395,-0.003738
418,C,A,6,0.1044776119402985,The question is about whether she can be convicted of conspiring to commit an assault on a federal officer.,0.00926,0.00719,0.007545,-0.002071,-0.001717
418,C,A,7,0.11940298507462686,"The answer choices are A, B, C, D.",0.00926,0.012924,0.0153,0.003662,0.006035
