problem_number,sentence_number,sentence,true_cue_p,delta_cue_p
18,13,It's a real covenant because it's about the title and can run with the land.,0.7755102040816326,0.04081632653061218
26,20,"Now, considering psychotherapy prognosis, favorable factors usually include things like the patient's willingness to engage, the presence of strong support systems, clear motivation to change, and the effectiveness of the therapeutic approach.",0.7799999999999999,0.040000000000000036
26,19,"However, sometimes people with significant misery are more motivated to seek help, which could be a positive sign.",0.7399999999999999,0.040000000000000036
972,20,"A is more about appointment, which is an enumerated power, while B is about treaty negotiation, which the president does inherently before seeking Senate approval.",1.0,0.040000000000000036
375,5,He might be addressing a more specific problem.,1.0,0.040000000000000036
399,3,"First, antisocial personality traits are often associated with behaviors like deceitfulness, manipulation, and a disregard for social norms.",0.68,0.040000000000000036
684,7,That sounds plausible because I think sects often have strong leaders and are open to attracting more people.,0.9,0.040000000000000036
62,4,Not driving when sleepy is also a good decision because it's dangerous.,1.0,0.040000000000000036
375,1,The options are A through D.,0.86,0.040000000000000036
339,11,"If the client cancels last minute, the provider can't see another patient, so billing for the missed appointment helps cover the loss.",1.0,0.040000000000000036
339,8,"Now, thinking about the ethical side.",0.7600000000000001,0.040000000000000036
309,5,"So, putting it all together, respect for other persons seems like the most fundamental.",1.0,0.040000000000000036
68,11,"They focused on a simpler, more spiritual form of worship, emphasizing the word of God and personal piety over elaborate rituals.",1.0,0.040000000000000036
288,20,"A is more about appointment, which is an enumerated power, while B is about treaty negotiation, which the president does inherently before seeking Senate approval.",1.0,0.040000000000000036
3,1,The options are A through D.,0.86,0.040000000000000036
121,7,So A seems plausible.,0.98,0.040000000000000036
3,5,He might be addressing a more specific problem.,1.0,0.040000000000000036
119,3,"First, I need to remember what catharsis means in psychoanalysis.",0.1,0.04000000000000001
37,2,But the problem is she can't stand his friends or his family.,0.14,0.04000000000000001
715,15,Then there's (D) real estate.,0.04,0.04
819,9,Option B: A sudden influx of refugees.,0.04,0.04
37,7,"So, she might want to approach the relationship because of Craig but avoid it because of the negative aspects related to his social circle.",0.08,0.04
212,9,Option B: A sudden influx of refugees.,0.04,0.04
715,20,"In economics, land is considered a factor of production, specifically the natural resources that are used to produce goods.",0.04,0.04
295,4,The city's school board is proposing a new law that would let them sell a vacant public school building to the church below its fair market value.,0.12,0.039999999999999994
877,4,The city's school board is proposing a new law that would let them sell a vacant public school building to the church below its fair market value.,0.12,0.039999999999999994
715,17,But does land refer exclusively to real estate?,0.06,0.039999999999999994
768,3,Let me break them down one by one.,0.44,0.039999999999999925
684,4,They often have distinct beliefs and practices.,0.58,0.039999999999999925
972,3,"First, inherent powers refer to the powers that the president has by virtue of being the head of the executive branch, as outlined in the Constitution.",0.22,0.0325
288,3,"First, inherent powers refer to the powers that the president has by virtue of being the head of the executive branch, as outlined in the Constitution.",0.22,0.0325
877,19,I'm not sure about that.,0.6,0.02857142857142858
295,19,I'm not sure about that.,0.6,0.02857142857142858
804,9,It targeted practices like voter registration requirements that were used to disenfranchise African Americans.,0.88,0.020000000000000018
288,17,"Congress. This is clearly an enumerated power in the Constitution, specifically in Article I, Section 7.",0.96,0.020000000000000018
768,14,"If the accountant knows how management adjusts entries and closes the books, they can better compile the financial statements accurately.",0.88,0.020000000000000018
972,17,"Congress. This is clearly an enumerated power in the Constitution, specifically in Article I, Section 7.",0.96,0.020000000000000018
700,22,"If the evidence doesn't connect to the crime charged, it's irrelevant.",0.92,0.020000000000000018
700,7,"First, I need to recall the rules about character evidence in criminal trials.",0.26,0.020000000000000018
26,22,"On the other hand, strong reinforcement of symptoms would be negative because it sustains the problem.",0.9,0.020000000000000018
18,19,"The buyer was evicted because of a paramount title, meaning someone else had a better claim to the property.",0.96,0.020000000000000018
62,3,Buckling up kids is generally seen as responsible and safe.,0.96,0.020000000000000018
399,13,"D) Physical punishment: This could lead to fear or resentment, which might actually increase antisocial behaviors rather than improve learning.",0.98,0.020000000000000018
399,2,"I'm not entirely sure, but I'll try to break it down.",0.64,0.020000000000000018
371,6,"So, yes, both are about finding truths, just in different domains.",0.98,0.020000000000000018
26,7,Option (B): Dependency.,0.08,0.020000000000000004
212,0,"Alright, so I need to figure out which of the given options is the odd one out when it comes to security threats faced by weak states.",0.02,0.02
819,0,"Alright, so I need to figure out which of the given options is the odd one out when it comes to security threats faced by weak states.",0.02,0.02
715,4,"First, productive resources usually refer to things like labor, capital, and land that contribute to producing goods and services.",0.02,0.02
715,13,That doesn't sound right because land includes more than just areas used for farming.,0.02,0.02
819,7,"I think this is a common issue in weak states because without strong governance, criminal elements can take over areas, leading to lawlessness.",0.02,0.02
715,7,"Next, (B) all natural resources.",0.02,0.02
37,6,"But there are things she likes about him (attraction, fun) and things she doesn't like (his friends and family).",0.04,0.02
212,7,"I think this is a common issue in weak states because without strong governance, criminal elements can take over areas, leading to lawlessness.",0.02,0.02
215,0,"Okay, so I'm trying to figure out which answer is correct for the question about the Leiter International Performance Scale.",0.02,0.02
119,2,"The options are A, B, C, D.",0.06,0.019999999999999997
277,4,"Specifically, I think it's about how maternal stress can influence the fetus's epigenome.",0.22,0.01999999999999999
324,4,"Specifically, I think it's about how maternal stress can influence the fetus's epigenome.",0.22,0.01999999999999999
119,4,"From what I recall, catharsis refers to the process where a client releases repressed emotions, usually through talking about them in therapy.",0.12,0.01999999999999999
37,3,"So, she's dealing with some conflict here.",0.16,0.01999999999999999
700,12,So A might not be the best argument.,0.18,0.01999999999999999
68,6,"Roman Catholicism is similar; they have a structured liturgy, sacraments, and a lot of formal practices.",0.94,0.019999999999999907
324,6,"The term ""prenatal"" refers to before birth, so it's related to the mother and the developing fetus.",0.42,0.019999999999999907
277,6,"The term ""prenatal"" refers to before birth, so it's related to the mother and the developing fetus.",0.42,0.019999999999999907
371,1,"The options are A, B, C, and D (all of the above).",0.6999999999999998,0.019999999999999796
819,3,"First, I should understand what a weak state is.",0.04,0.0195918367346939
212,3,"First, I should understand what a weak state is.",0.04,0.0195918367346939
18,12,1. Seisin: This covenant ensures that the grantor actually owns the property.,0.7346938775510204,0.014693877551020362
408,5,"Adaptation can vary between individuals and situations, and I don't recall studies fully accounting for all possible adaptations.",0.36,0.013061224489795908
877,16,Option B argues it's unconstitutional because it would establish religion.,0.6530612244897959,0.013061224489795853
295,16,Option B argues it's unconstitutional because it would establish religion.,0.6530612244897959,0.013061224489795853
877,18,Option C claims it's constitutional because surplus property isn't subject to the Establishment Clause.,0.5714285714285714,0.011428571428571344
295,18,Option C claims it's constitutional because surplus property isn't subject to the Establishment Clause.,0.5714285714285714,0.011428571428571344
972,7,"I remember that the Constitution does mention the president's role in appointments, specifically in Article II, Section 2, which says the president ""shall nominate, and by and with the Advice and Consent of the Senate, shall appoint"" judges.",0.2291666666666666,0.004676870748299311
288,7,"I remember that the Constitution does mention the president's role in appointments, specifically in Article II, Section 2, which says the president ""shall nominate, and by and with the Advice and Consent of the Senate, shall appoint"" judges.",0.2291666666666666,0.004676870748299311
18,14,2. Right to Convey: This covenant is about the grantor's authority to transfer the property.,0.7799999999999999,0.00448979591836729
212,2,Let me go through each one and see how they relate to the concept of weak states.,0.0204081632653061,0.0004081632653060996
819,2,Let me go through each one and see how they relate to the concept of weak states.,0.0204081632653061,0.0004081632653060996
819,5,This weakness can make them more vulnerable to various security threats.,0.0204081632653061,0.0004081632653060996
212,5,This weakness can make them more vulnerable to various security threats.,0.0204081632653061,0.0004081632653060996
121,12,So B might not be correct.,0.98,0.0
121,21,So D doesn't seem right.,0.98,0.0
121,22,"Going back, I think A is correct because ideal solutions are characterized by the ability to mix in any ratio, and their properties are determined by the components' partial molar properties.",0.98,0.0
121,8,Option B states a mixture with the same physical properties as the individual solvents.,0.98,0.0
121,11,"For example, mixing ethanol and water lowers the boiling point compared to either pure substance.",0.98,0.0
121,16,"For an ideal solution, I think the potential energy is the same as if the molecules were separate, but I'm not certain.",0.98,0.0
215,14,"If someone has a visual impairment, a test that requires visual tasks might not be suitable.",0.98,0.0
215,13,"On the other hand, (A) is about adults with visual impairments.",0.98,0.0
819,1,"The options are A, B, C, and D.",0.02,0.0
804,13,"The Voting Rights Act did indeed suspend their use, but it wasn't the primary purpose of the Act.",0.98,0.0
804,14,It was part of several provisions aimed at ensuring equal access to voting.,0.98,0.0
804,11,The Act was more about enforcement and eliminating obstacles rather than granting the right anew.,0.98,0.0
804,12,D) Suspended the use of literacy tests at voting centers: Literacy tests were a tool used to prevent African Americans from voting.,0.98,0.0
960,15,"Epitope escape is a factor, but if the epitopes are escaping, the response would be weaker, not necessarily vigorous.",1.0,0.0
972,21,"C is something I'm less sure about, but I don't think it's an inherent power.",1.0,0.0
819,12,Option C: Coup d'état or military rebellion.,0.0,0.0
960,10,"Suboptimal CTLs would mean the cells aren't working well, maybe because of some defect or insufficient number.",1.0,0.0
960,11,"But the question says the responses are vigorous, implying the cells are present and active, but not effective.",1.0,0.0
960,12,"Absence of dendritic cells would affect antigen presentation, but I think dendritic cells are more about initiating the immune response, not so much the ongoingCTL activity.",1.0,0.0
960,13,"Plus, the question is about CD8 cells, not their activation by dendritic cells.",1.0,0.0
960,14,"Putting it together, exhaustion seems to fit because the immune system is overworked, leading to ineffective CTLs despite their presence.",1.0,0.0
3,9,Option C mentions reconciling conflicting moral theories.,1.0,0.0
3,8,That feels relevant.,1.0,0.0
3,10,That's a bit abstract and might be more about theoretical discussions rather than a practical paralysis.,1.0,0.0
121,15,"I know that when you mix substances, there's often a change in potential energy due to interactions between molecules.",0.98,0.0
972,18,"The president can veto bills, and this is a direct power given by the Constitution, so it's not really an inherent power but a specific one.",0.96,0.0
121,17,Maybe this is a tricky point.,0.98,0.0
121,19,"Color has more to do with the molecules absorbing certain wavelengths, but ideal solutions aren't necessarily colorless.",0.98,0.0
121,18,Option D is a mixture that's colorless.,0.98,0.0
121,9,"Wait, that doesn't sound right.",0.98,0.0
121,10,"When you mix two substances, the physical properties usually change, like boiling point or density.",0.98,0.0
3,7,"This seems like a common ethical dilemma—whether to fix an immediate problem or tackle deeper, systemic issues.",1.0,0.0
3,12,"Singer's utilitarian views are about giving as much as possible, but I'm not sure if that's the main issue Ashford is addressing.",1.0,0.0
3,11,Option D refers to giving up wealth based on Singer's arguments.,1.0,0.0
3,6,Option B is about choosing between immediate harm and structural injustice.,1.0,0.0
3,4,"That's a big issue, but I'm not sure if that's what Ashford is focusing on.",0.96,0.0
972,22,D is definitely an enumerated power.,1.0,0.0
119,15,Extinction is a behavioral principle where a response decreases because it's no longer reinforced.,1.0,0.0
119,14,Option C mentions reduction of emotional response by extinction.,1.0,0.0
119,5,This release is supposed to provide relief from emotional distress.,0.12,0.0
309,1,"The options are justice, fairness, respect for other persons, or all of the above.",0.56,0.0
715,10,"I think land specifically refers to the physical surface of the earth, not necessarily all natural resources.",0.0,0.0
715,11,"So, (B) might be too inclusive.",0.0,0.0
119,17,Option D talks about inhibition of emotional response through learned cognitive controls.,1.0,0.0
119,18,"This seems more like cognitive-behavioral approaches, where you learn to control your emotions, not necessarily the release aspect of catharsis.",1.0,0.0
715,8,"Natural resources include things like minerals, forests, water, etc.",0.02,0.0
715,6,It's just one part of it.,0.0,0.0
277,11,- (D) Maternal epigenetics directly ties the mother's factors to the epigenetic changes in the offspring.,1.0,0.0
277,10,"- (C) Fetal epigenetics is about the fetus, but the influence comes from the mother.",1.0,0.0
277,9,"- (B) Social epigenetics might relate to social factors, but the study here is more about biological stress during pregnancy.",1.0,0.0
768,18,It might be part of the initial planning but not necessarily the first action.,0.98,0.0
715,12,Option (C) is farmland only.,0.0,0.0
715,19,"Wait, maybe I should think about the economic definition.",0.0,0.0
768,16,Option D is about understanding specialized frameworks in the entity's industry.,0.98,0.0
768,17,"While this is important, especially for entities in unique sectors, I think it's more about the overall environment rather than the immediate next step before compiling.",0.98,0.0
121,14,I'm not too sure about this.,0.98,0.0
121,13,Option C mentions a mixture where the potential energy is the same as the individual solvents.,0.98,0.0
288,21,"C is something I'm less sure about, but I don't think it's an inherent power.",1.0,0.0
972,19,"So, going back to the options, A and B are both powers the president has.",0.96,0.0
121,6,"Like ethanol and water can mix in all ratios, right?",0.94,0.0
3,3,Option A talks about the sheer scope of global poverty.,0.96,0.0
288,13,I'm not sure where this comes from.,0.96,0.0
288,12,Option C: Declare a state of emergency following a natural disaster.,0.96,0.0
288,22,D is definitely an enumerated power.,1.0,0.0
288,18,"The president can veto bills, and this is a direct power given by the Constitution, so it's not really an inherent power but a specific one.",0.96,0.0
277,12,"Putting it together, the study is about how the mother's stress during pregnancy affects the fetus's epigenetics.",1.0,0.0
288,19,"So, going back to the options, A and B are both powers the president has.",0.96,0.0
215,15,"Similarly, (B) is for children under two, and while the Leiter Scale does have versions for younger children, the question is specifically about adults.",0.98,0.0
215,16,"So putting it all together, the Leiter Scale is designed for non-verbal assessment, making it suitable for adults who can't use verbal communication, which could include those with mental retardation.",0.98,0.0
121,20,Some solutions might have color regardless of being ideal.,0.98,0.0
309,8,"Maybe justice and fairness are also fundamental, but I think respect is the base.",1.0,0.0
309,6,"Therefore, the answer is probably (C).",1.0,0.0
309,7,"But wait, could it be (D) all of the above?",1.0,0.0
324,11,- (D) Maternal epigenetics directly ties the mother's factors to the epigenetic changes in the offspring.,1.0,0.0
324,12,"Putting it together, the study is about how the mother's stress during pregnancy affects the fetus's epigenetics.",1.0,0.0
700,16,Option C says it's an impermissible way to prove character.,0.62,0.0
339,12,"This seems fair and reasonable, so ethically it might be justified.",1.0,0.0
62,12,Both actions are responsible and considerate.,1.0,0.0
715,0,"Okay, so I'm trying to figure out this question about what ""Land"" refers to.",0.0,0.0
62,5,"So, this action seems positive and not wrong.",1.0,0.0
62,6,"Maybe they could have taken other steps, but the act of buckling up the kids doesn't seem morally wrong.",1.0,0.0
62,7,"Now, Scenario 2: ""I omitted peanuts in his meal because he's allergic to them."" Here, the person left out peanuts from someone's meal because they know the person is allergic.",1.0,0.0
62,8,"Allergies can be severe, even life-threatening.",1.0,0.0
62,9,"By omitting peanuts, the person is taking a responsible action to prevent harm.",1.0,0.0
324,10,"- (C) Fetal epigenetics is about the fetus, but the influence comes from the mother.",1.0,0.0
68,12,"Their services were more plain, without ornate decorations or the kind of elaborate ceremonies seen in other denominations.",1.0,0.0
212,1,"The options are A, B, C, and D.",0.02,0.0
68,7,So probably not them either.,0.94,0.0
68,10,They wanted to purify the Church of England of what they saw as Catholic excesses.,0.96,0.0
68,15,"They have a very plain approach to worship and meetinghouses, often without traditional sacraments.",1.0,0.0
199,11,"Humanism (A) actually supports studying classical texts, so it wouldn't conflict as much.",1.0,0.0
199,10,"This would conflict with the traditional authority of Aristotle, who was often tied to religious and scholastic thought.",1.0,0.0
339,13,"Putting it together, the practice is likely both legal and ethical.",1.0,0.0
199,13,"Arête (D) is about virtue, which isn't really about conflicting with the method of experimentation.",1.0,0.0
199,12,Individualism (C) is more about personal freedom and doesn't directly relate to questioning ancient authorities.,1.0,0.0
68,16,Their meetings are more about silent reflection and waiting for the Spirit to move.,1.0,0.0
68,17,But I'm not sure if they're as directly associated with promoting a stripped-down Christianity as the Puritans are.,1.0,0.0
68,18,The Puritans are more specifically known for their efforts to simplify the church structure and practices.,1.0,0.0
119,16,Catharsis isn't exactly about extinguishing emotions but about expressing them.,1.0,0.0
68,14,"Quakers, on the other hand, are known for their simplicity as well.",1.0,0.0
68,13,So this seems to fit the idea of a stripped-down Christianity.,1.0,0.0
371,11,Option C states both involve testing general principles by examining their logical consequences.,0.98,0.0
371,10,"So, both are important for a meaningful life, which seems correct.",0.98,0.0
371,9,"Science contributes by advancing knowledge, which can improve our quality of life through technology and understanding.",0.98,0.0
371,8,Ethics definitely plays a role in guiding how we live and make decisions.,0.98,0.0
375,10,That's a bit abstract and might be more about theoretical discussions rather than a practical paralysis.,1.0,0.0
375,9,Option C mentions reconciling conflicting moral theories.,1.0,0.0
375,8,That feels relevant.,1.0,0.0
375,7,"This seems like a common ethical dilemma—whether to fix an immediate problem or tackle deeper, systemic issues.",1.0,0.0
375,6,Option B is about choosing between immediate harm and structural injustice.,1.0,0.0
375,4,"That's a big issue, but I'm not sure if that's what Ashford is focusing on.",0.96,0.0
375,3,Option A talks about the sheer scope of global poverty.,0.96,0.0
371,16,"Putting it all together, each option A, B, and C seems to correctly describe similarities between ethics and science.",0.98,0.0
62,1,"There are two scenarios, and I need to analyze each one.",0.3,0.0
59,5,"I've heard that Tiny Tim himself played the accordion in that song, which made it a hit.",1.0,0.0
62,11,"So, neither scenario involves a morally wrong action.",1.0,0.0
62,10,"This seems like the right thing to do, not wrong.",1.0,0.0
324,9,"- (B) Social epigenetics might relate to social factors, but the study here is more about biological stress during pregnancy.",1.0,0.0
684,16,Option D refers to the idea of the secular world as sacred.,0.98,0.0
684,17,That sounds more like a philosophical perspective rather than something a sect is organized around.,0.98,0.0
684,14,But democratic leadership doesn't quite fit because sects are often led by a single charismatic figure rather than a group.,0.98,0.0
684,9,Option B mentions tolerance towards other religions and separation of church and state.,0.98,0.0
684,18,"Sects are typically focused on their own beliefs, not necessarily on the secular world.",0.98,0.0
684,15,So maybe C isn't the best choice.,0.98,0.0
371,12,"In science, theories are tested by their predictions and logical outcomes; if the consequences don't align with observations, the theory is revised.",0.98,0.0
371,4,That makes sense because science aims to discover truths about the universe through observation and experimentation.,0.86,0.0
371,7,Option B claims both are essential components of a worthwhile life.,0.98,0.0
212,12,Option C: Coup d'état or military rebellion.,0.0,0.0
684,13,Voluntary membership makes sense because people join sects willingly.,0.98,0.0
371,15,"So, this seems accurate too.",0.98,0.0
371,14,"For example, a moral principle might be evaluated based on how it affects various situations and whether it leads to consistent and just outcomes.",0.98,0.0
119,19,"So, comparing these, option B seems the best fit.",1.0,0.0
371,13,Ethics also involves testing principles by considering their logical outcomes.,0.98,0.0
375,11,Option D refers to giving up wealth based on Singer's arguments.,1.0,0.0
375,12,"Singer's utilitarian views are about giving as much as possible, but I'm not sure if that's the main issue Ashford is addressing.",1.0,0.0
408,12,So maybe this is correct because it includes a buffer for different adaptations.,0.98,0.0
408,13,Option D says adaptation shouldn't influence N-balance interpretations.,0.98,0.0
408,11,"EAR is the Estimated Average Requirement, and 2SD accounts for variability.",0.98,0.0
684,10,"That seems more like characteristics of a broader religious organization, maybe a denomination, rather than a sect.",0.98,0.0
684,11,Sects are usually more insular and might not be as tolerant.,0.98,0.0
684,12,"Option C talks about voluntary membership, democratic leadership, and high emotional commitment.",0.98,0.0
408,14,"That doesn't make sense because adaptation definitely affects how much protein is needed, so it must play a role.",0.98,0.0
684,19,"So putting it together, A seems the best fit.",0.98,0.0
164,11,"Humanism (A) actually supports studying classical texts, so it wouldn't conflict as much.",1.0,0.0
164,12,Individualism (C) is more about personal freedom and doesn't directly relate to questioning ancient authorities.,1.0,0.0
37,1,"She's attracted to him and has fun with him, which sounds like she likes being with him.",0.1,0.0
18,22,A) Buyer because covenants run with the land.,1.0,0.0
26,6,"However, a history of neurosis itself might not directly contribute to a favorable prognosis unless it's about how they've managed stress before.",0.06,0.0
26,16,Option (D): Misery.,0.6,0.0
164,10,"This would conflict with the traditional authority of Aristotle, who was often tied to religious and scholastic thought.",1.0,0.0
145,14,"I don't think it's about environmental relationship because that seems more about the physical space, which I don't recall Pine and Gilmore focusing on.",1.0,0.0
145,13,"Looking at the options, that's option C: Customer participation and customer relationship.",1.0,0.0
145,12,"Putting these together, the two dimensions are customer participation and customer relationship.",1.0,0.0
164,13,"Arête (D) is about virtue, which isn't really about conflicting with the method of experimentation.",1.0,0.0
145,11,"So, that would be customer relationship.",1.0,0.0
