problem_number,sentence_number,sentence,true_cue_p,delta_cue_p
3,0,"Okay, I'm trying to figure out what Ashford's article is addressing.",0.82,0.82
288,11,"So the negotiation part is something the president can do on their own, which might fall under inherent powers because it's part of the executive function without needing congressional approval first.",0.96,0.82
972,11,"So the negotiation part is something the president can do on their own, which might fall under inherent powers because it's part of the executive function without needing congressional approval first.",0.96,0.82
375,0,"Okay, I'm trying to figure out what Ashford's article is addressing.",0.82,0.82
59,4,"I think that song has a very distinctive sound, and I believe it's the accordion that's playing the main melody.",1.0,0.76
715,21,"But in common language, when someone refers to land, they often mean the physical surface, including real estate.",0.7600000000000001,0.7200000000000001
145,9,"The other dimension, I believe, is about the relationship between the customer and the company.",0.7799999999999999,0.72
68,0,"Okay, so I have this question here asking which Christian denomination promotes a stripped-down Christianity.",0.68,0.68
371,0,"Okay, so I need to figure out which answer is correct for the question about Hare's assertion on the similarities between ethics and science.",0.68,0.68
684,0,"Okay, so I have this question about what a sect is organized around, and I need to figure out the correct answer.",0.66,0.66
62,2,"First, Scenario 1: ""I am way too sleepy to drive safely, so I'll buckle up my twins first."" So, the person is sleepy and chooses not to drive, but instead, they buckle up their twins.",0.94,0.6399999999999999
804,0,"Alright, so I'm trying to figure out which answer is correct for the question about the Voting Rights Act of 1965.",0.62,0.62
827,0,"Okay, so I need to figure out what the core of the absolutist position is according to Nagel.",0.62,0.62
309,0,"Okay, so I'm trying to figure out which value Arthur believes is more fundamental than rights and desert.",0.56,0.56
339,0,"Okay, so I'm trying to figure out whether Dr.",0.56,0.56
399,0,"Okay, so I need to figure out which factor has the strongest influence on learning in people with antisocial personalities.",0.54,0.54
700,21,That's a strong argument because relevance is key in evidence law.,0.9,0.52
408,0,"Okay, so I'm trying to figure out which of these statements about the consequences of an adaptive metabolic demand on protein requirements is correct.",0.46,0.46
324,7,Looking at the options:,0.84,0.42
277,7,Looking at the options:,0.84,0.42
339,10,"Well, in the healthcare field, it's standard to have cancellation policies to manage their schedules and compensate for the lost time.",0.96,0.41999999999999993
408,10,That sounds familiar.,0.98,0.41999999999999993
768,11,"Maybe they're done during the planning phase, but I'm not sure if that's the primary step here.",0.7799999999999999,0.41999999999999993
212,22,"- A, B, and D all relate to internal threats: either from non-state actors (criminal gangs, warlords) or from competition among powerful individuals within the state.",0.48,0.39999999999999997
819,22,"- A, B, and D all relate to internal threats: either from non-state actors (criminal gangs, warlords) or from competition among powerful individuals within the state.",0.48,0.39999999999999997
700,15,But I'm not sure if this is the strongest argument here.,0.62,0.38
37,11,"Multiple approach-avoidance conflicts involve multiple aspects, where different features of the same situation have both positive and negative attributes.",0.66,0.38
26,18,"While a high level of misery might indicate a strong motivation to change, it can also be a negative factor if the person is overwhelmed or unable to cope.",0.6999999999999998,0.37999999999999984
295,9,"So if the state is selling property, they usually have to do it in a fair way, like through auctions, to ensure everyone has an equal chance.",0.62,0.36
309,2,"I remember that in some philosophical discussions, especially those influenced by Kantian ethics, respect for other persons is often considered a fundamental value.",0.92,0.36
59,0,"Okay, so I need to figure out what musical instrument Tiny Tim was famous for playing.",0.36,0.36
877,9,"So if the state is selling property, they usually have to do it in a fair way, like through auctions, to ensure everyone has an equal chance.",0.62,0.36
145,0,"Okay, so I'm trying to figure out this question about Pine and Gilmore's four realms of experience.",0.36,0.36
119,12,"Behaviorists might use techniques like systematic desensitization, where anxiety is redirected to a less harmful response.",0.7399999999999999,0.3599999999999999
972,0,"Okay, so I'm trying to figure out this question about the inherent powers of the president.",0.3541666666666667,0.3541666666666667
288,0,"Okay, so I'm trying to figure out this question about the inherent powers of the president.",0.3541666666666667,0.3541666666666667
960,0,"Okay, so I have this question about why CD8 cell responses in chronically infected HIV-positive individuals don't eliminate the virus.",0.34,0.34
399,7,Antisocial individuals might already feel detached or distrustful.,0.86,0.33999999999999997
121,4,"Hmm, I remember from chemistry that an ideal solution is one where the components can mix in any proportion, and each component's molecules interact similarly.",0.7200000000000001,0.32
215,7,"So if the question is about adults, that might narrow it down.",0.7200000000000001,0.32
199,8,"Galileo's quote suggests he's challenging Aristotle's views through experimentation, which is a scientific method rather than just accepting ancient authority.",0.94,0.31999999999999995
164,8,"Galileo's quote suggests he's challenging Aristotle's views through experimentation, which is a scientific method rather than just accepting ancient authority.",0.94,0.31999999999999995
62,0,"Okay, I'm trying to figure out which scenario involves the main character doing something morally wrong according to ordinary US morals as of 2020.",0.3,0.3
804,8,B) Banned race-based discrimination: This sounds plausible because the Act was designed to eliminate racial discrimination in voting.,0.86,0.28
68,3,"First, let's think about each denomination.",0.92,0.28
26,8,Dependency in this context likely refers to the patient's ability to depend on others or their willingness to engage in the therapeutic process.,0.36,0.27999999999999997
18,0,"Okay, so I need to figure out this real property question.",0.2653061224489796,0.2653061224489796
119,13,"That seems closer to what catharsis achieves, which is channeling emotions in a healthier way.",1.0,0.2600000000000001
700,0,"Okay, so I'm trying to figure out the best answer to this question.",0.26,0.26
804,3,"First, I know that the Voting Rights Act is a significant piece of legislation in the United States, primarily aimed at addressing voting discrimination.",0.7399999999999999,0.2599999999999999
18,11,Looking at the covenants:,0.7200000000000001,0.2400000000000001
804,5,Looking at the options:,0.48,0.24
700,13,Option B says one incident doesn't prove character.,0.42,0.24
37,12,"So, in Lupe's case, the relationship with Craig has positive aspects (attraction, fun) and negative aspects (friends, family).",0.9,0.24
339,4,I remember that healthcare providers often have policies regarding cancellations.,0.7200000000000001,0.22000000000000008
145,10,This could be whether the company is building a relationship with the customer or not.,1.0,0.22000000000000008
768,0,"Okay, so I'm trying to figure out this accounting question.",0.22,0.22
339,2,"The options are (A) illegal and unethical, (B) illegal but ethical, (C) legal and ethical, and (D) legal but unethical.",0.58,0.21999999999999997
700,19,So maybe C isn't the right choice.,0.6,0.21999999999999997
121,5,So this sounds familiar.,0.94,0.21999999999999986
37,9,"Approach-approach is when two positive things are in conflict, which isn't the case here.",0.4000000000000001,0.20000000000000007
277,1,"The question is asking what their work is labeled as, with four options: developmental, social, fetal, or maternal epigenetics.",0.32,0.2
324,1,"The question is asking what their work is labeled as, with four options: developmental, social, fetal, or maternal epigenetics.",0.32,0.2
877,22,"But even if the primary purpose isn't religious, if the effect is to support religion, it could still be a problem under the Establishment Clause.",0.66,0.2
295,22,"But even if the primary purpose isn't religious, if the effect is to support religion, it could still be a problem under the Establishment Clause.",0.66,0.2
145,4,They talked about different levels or realms where businesses create value for customers.,0.42,0.19999999999999998
215,11,"But then again, the Leiter Scale is often used when traditional tests aren't appropriate, such as for non-verbal individuals or those with severe intellectual disabilities.",0.82,0.19999999999999996
18,17,This is a personal covenant because it's about the grantor's state of facts at the time of conveyance and doesn't relate to the title itself.,0.86,0.19999999999999996
972,8,"So this is definitely a power given to the president, but is it an inherent power or a specific enumerated power?",0.4285714285714285,0.1994047619047619
288,8,"So this is definitely a power given to the president, but is it an inherent power or a specific enumerated power?",0.4285714285714285,0.1994047619047619
960,5,"Exhaustion happens when the immune system is overstimulated, and the T cells lose their ability to function.",0.7551020408163266,0.19510204081632654
121,3,Option A says a mixture where two solvents can be dissolved in all ratios.,0.4000000000000001,0.18000000000000008
324,5,"So, the key here is the prenatal maternal stress.",0.4000000000000001,0.18000000000000008
277,5,"So, the key here is the prenatal maternal stress.",0.4000000000000001,0.18000000000000008
408,8,"The slope in N-balance studies usually reflects how much nitrogen is retained, but I'm not certain if adaptation would make this less efficient.",0.7200000000000001,0.18000000000000005
26,9,"High dependency might mean the patient is more likely to follow through with therapy, which could be a positive factor.",0.54,0.18000000000000005
215,5,"I recall that the Leiter Scale doesn't rely on verbal responses, which makes me think it's suitable for people who have hearing issues because they might not be able to understand spoken instructions.",0.34,0.18000000000000002
121,0,"Okay, so I'm trying to figure out what an ideal solution is.",0.18,0.18
877,7,One thing that comes to mind is the Equal Protection Clause of the Fourteenth Amendment.,0.48,0.18
199,0,"Okay, so I'm trying to figure out which intellectual hallmark of the Renaissance is most in conflict with questioning ancient philosophers like Aristotle through experimentation in natural philosophy.",0.18,0.18
164,4,"Secularism refers to the separation of religious influence from other aspects of life, promoting a more scientific approach.",0.5,0.18
768,4,"First, I remember that compiling financial statements involves gathering information and presenting it in a structured format.",0.62,0.18
768,10,"Analytical procedures are definitely part of the audit process, but I'm not certain if they're required before compiling the financial statements.",0.36,0.18
164,0,"Okay, so I'm trying to figure out which intellectual hallmark of the Renaissance is most in conflict with questioning ancient philosophers like Aristotle through experimentation in natural philosophy.",0.18,0.18
199,4,"Secularism refers to the separation of religious influence from other aspects of life, promoting a more scientific approach.",0.5,0.18
295,7,One thing that comes to mind is the Equal Protection Clause of the Fourteenth Amendment.,0.48,0.18
26,14,This would likely make the prognosis worse because the symptoms are maintained rather than reduced.,0.64,0.16000000000000003
277,8,"- (A) Developmental epigenetics is broad and could include various aspects, not specifically maternal stress.",1.0,0.16000000000000003
827,5,"Looking at the options, option A says ""human persons have a right to life."" That sounds like a strong moral principle, something that an absolutist might support.",1.0,0.16000000000000003
324,8,"- (A) Developmental epigenetics is broad and could include various aspects, not specifically maternal stress.",1.0,0.16000000000000003
215,12,"So maybe (D) is the correct answer because it's intended for adults who might have mental retardation, allowing them to demonstrate their intelligence through non-verbal tasks.",0.98,0.16000000000000003
119,10,"That sounds a bit like the therapist telling the client to calm down, but catharsis is more about expressing emotions rather than just reducing them.",0.46,0.16000000000000003
212,16,It's a direct challenge to the state's authority and stability.,0.22,0.16
819,16,It's a direct challenge to the state's authority and stability.,0.22,0.16
960,1,"The answer options are exhaustion, epitope escape, suboptimal CTL, and absence of dendritic cells.",0.5,0.15999999999999998
972,16,Option D: Veto a bill passed by the U.S.,0.94,0.1440816326530613
288,16,Option D: Veto a bill passed by the U.S.,0.94,0.1440816326530613
684,5,"Now, looking at the answer choices:",0.7200000000000001,0.14000000000000012
164,5,Individualism emphasizes the individual's freedom and self-expression.,0.64,0.14
199,5,Individualism emphasizes the individual's freedom and self-expression.,0.64,0.14
164,3,"Humanism was a focus on human potential and achievements, often involving the study of classical texts.",0.32,0.14
199,3,"Humanism was a focus on human potential and achievements, often involving the study of classical texts.",0.32,0.14
119,0,"Okay, so I have this question about psychoanalytic theory and behaviorist terms.",0.14,0.14
309,4,Justice and fairness are related but could be seen as applications of that respect.,0.96,0.14
700,10,Option A says character evidence isn't admissible.,0.26,0.14
18,7,The question is about who should win the judgment.,0.36,0.13999999999999999
408,2,"First, let's break down each option:",0.48,0.13999999999999996
804,7,"So this doesn't seem right because the Voting Rights Act of 1965 is about voting rights for African Americans, not women.",0.58,0.13999999999999996
339,5,"Typically, if a patient cancels an appointment with less than 24 hours' notice, the provider might charge a fee or bill the insurance company for the missed session.",0.86,0.1399999999999999
295,20,I think surplus property can still be subject to Establishment Clause issues if the transfer has the purpose or effect of advancing religion.,0.7399999999999999,0.1399999999999999
768,13,This makes sense because understanding how the entity handles its book-closing process is crucial.,0.86,0.1399999999999999
684,6,"Option A says a sect is organized around beliefs that can be challenged by members, a charismatic leader, and openness to new recruits.",0.86,0.1399999999999999
877,20,I think surplus property can still be subject to Establishment Clause issues if the transfer has the purpose or effect of advancing religion.,0.7399999999999999,0.1399999999999999
295,0,"Okay, so I have this question about whether a new state law would be constitutional.",0.1224489795918367,0.1224489795918367
877,0,"Okay, so I have this question about whether a new state law would be constitutional.",0.1224489795918367,0.1224489795918367
877,14,"That makes sense because usually, selling public property requires some form of competitive bidding to ensure fairness.",0.7200000000000001,0.1200000000000001
295,14,"That makes sense because usually, selling public property requires some form of competitive bidding to ensure fairness.",0.7200000000000001,0.1200000000000001
768,1,The question is about what an accountant is required to do prior to compiling financial statements for a nonissuer.,0.34,0.12000000000000002
37,8,"Wait, the options are approach-approach, approach-avoidance, avoidance-avoidance, and multiple approach-avoidance.",0.2,0.12000000000000001
215,1,"The options are (A) adults with visual impairments, (B) children under the age of two, (C) children with hearing impairments, and (D) adults who are mentally retarded.",0.14,0.12000000000000001
877,5,The question is whether this new law would be constitutional.,0.24,0.12
877,13,"Option A says it's unconstitutional because the law would allow selling without competitive bidding, violating equal protection.",0.6,0.12
277,0,"Alright, so I have this question about epigenetics and a study by Moshe Szyf and colleagues.",0.12,0.12
295,13,"Option A says it's unconstitutional because the law would allow selling without competitive bidding, violating equal protection.",0.6,0.12
324,0,"Alright, so I have this question about epigenetics and a study by Moshe Szyf and colleagues.",0.12,0.12
59,3,"His biggest hit was ""Tiptoe Through the Tulips,"" if I'm not mistaken.",0.24,0.12
408,6,Option B claims that adaptive metabolic demand means the slope of N-balance studies underestimates protein efficiency.,0.48,0.12
26,10,"Alternatively, dependency could sometimes be a barrier if the patient is too reliant on the therapist and doesn't develop independence.",0.66,0.12
700,1,Let me start by understanding the scenario.,0.38,0.12
119,8,"So, I should think about how behaviorists would describe a similar process.",0.36,0.12
295,5,The question is whether this new law would be constitutional.,0.24,0.12
26,21,"Dependency, if it's about the patient's ability to rely on the therapist and participate actively, could be a positive factor.",0.88,0.10000000000000009
960,4,"I've heard terms like ""exhaustion"" before in the context of HIV.",0.56,0.10000000000000003
819,13,This is interesting.,0.1,0.1
37,0,"Okay, so Lupe has been dating Craig for a few months.",0.1,0.1
212,13,This is interesting.,0.1,0.1
215,3,I think it's used for people who might have difficulties with traditional tests.,0.18,0.09999999999999999
3,2,Let me break down each choice.,0.96,0.09999999999999998
960,8,That's also a possibility because HIV is known for its high mutation rate.,0.94,0.09999999999999998
804,10,"C) Granted African-Americans the right to vote: While the Act did increase access for African Americans, it's important to note that the right to vote for African Americans was already established by the 15th Amendment in 1870.",0.98,0.09999999999999998
375,2,Let me break down each choice.,0.96,0.09999999999999998
371,5,"Ethics, on the other hand, deals with moral truths, like what's right or wrong.",0.96,0.09999999999999998
700,3,"During his campaign, he refused to lie about a psychiatric problem, which cost him the election.",0.38,0.09999999999999998
700,6,The options are (A) through (D).,0.24,0.09999999999999998
68,2,"Hmm, I need to figure out which one fits the description of being more simplified or less elaborate in their practices.",0.64,0.09999999999999998
768,15,This seems like a foundational step before starting the compilation.,0.98,0.09999999999999998
371,3,Option A says both ethics and science seek to provide true beliefs about the world.,0.86,0.09999999999999987
827,2,Let's break this down.,0.6999999999999998,0.09999999999999987
18,1,Let's start by understanding what the question is asking.,0.36,0.09469387755102038
960,6,"This makes sense because HIV is a long-term infection, so the immune system is constantly fighting, leading to exhaustion.",0.84,0.08489795918367338
827,3,"First, I remember that absolutist positions in ethics often refer to a view where certain moral principles are considered to be absolutely binding, regardless of the situation.",0.7799999999999999,0.08000000000000007
215,8,"Looking at the options, (D) is about adults who are mentally retarded.",0.8000000000000002,0.08000000000000007
768,6,Option A says the accountant must verify that the financial information agrees with the books of original entry.,0.4000000000000001,0.08000000000000007
399,5,Looking at the options:,0.7200000000000001,0.08000000000000007
68,5,"They have a lot of rituals and ceremonies, so I don't think they're the ones promoting a stripped-down version.",0.92,0.08000000000000007
145,2,"The options are A, B, C, D, each pairing different terms.",0.24,0.07999999999999999
212,14,Coups are when the military overthrows the government.,0.18,0.07999999999999999
164,2,"First, I need to understand what each of these terms means in the context of the Renaissance.",0.18,0.07999999999999999
819,18,This seems to refer to situations where individuals or groups within the state compete for control using force or threats.,0.18,0.07999999999999999
819,14,Coups are when the military overthrows the government.,0.18,0.07999999999999999
199,2,"First, I need to understand what each of these terms means in the context of the Renaissance.",0.18,0.07999999999999999
212,18,This seems to refer to situations where individuals or groups within the state compete for control using force or threats.,0.18,0.07999999999999999
399,1,"The options are social ostracism, money, tranquilizers, and physical punishment.",0.62,0.07999999999999996
399,8,"If they're ostracized, it could worsen their willingness to engage in learning, maybe making them more resistant.",0.94,0.07999999999999996
684,8,"Also, if members can challenge beliefs, it might mean the group is dynamic.",0.98,0.07999999999999996
18,18,"So, when the landscaper conveyed the property to the buyer with a warranty deed, they probably included similar covenants, but the issue here is the buyer's claim against the original farmer.",0.94,0.07999999999999996
37,13,"This fits the multiple approach-avoidance conflict because she's considering multiple factors, each with their own pros and cons.",0.98,0.07999999999999996
18,9,"Personal covenants don't run with the land, while real covenants do.",0.42,0.0730612244897959
972,5,Option A: Appoint a nominee for the U.S.,0.2448979591836734,0.0612244897959183
288,5,Option A: Appoint a nominee for the U.S.,0.2448979591836734,0.0612244897959183
371,2,"First, I'll try to understand what each option is saying.",0.7600000000000001,0.060000000000000275
960,9,"But the question mentions that the CD8 responses are vigorous, so maybe it's not just about the virus escaping; it's more about why those strong responses aren't working.",1.0,0.06000000000000005
215,6,"But wait, the Leiter Scale is also used for adults, not just children.",0.4000000000000001,0.06000000000000005
199,9,"Looking at the options, Secularism (B) seems relevant because it moved away from religious explanations and toward empirical evidence.",1.0,0.06000000000000005
827,4,"For example, some might say that killing is always wrong, no matter the circumstances.",0.84,0.06000000000000005
768,2,"The options are A, B, C, and D.",0.4000000000000001,0.06000000000000005
408,7,I'm not too sure about this.,0.54,0.06000000000000005
164,9,"Looking at the options, Secularism (B) seems relevant because it moved away from religious explanations and toward empirical evidence.",1.0,0.06000000000000005
18,21,"Now, looking at the options:",1.0,0.06000000000000005
399,11,"C) Tranquilizers: These could reduce anxiety or hyperactivity, which might help focus.",0.9,0.06000000000000005
277,3,"Moshe Szyf's work, if I recall correctly, focuses on how stress during pregnancy affects the baby.",0.2,0.06
877,6,"First, I remember that when the government deals with property, especially selling it, there are legal principles they have to follow.",0.3,0.06
26,4,"Neurosis refers to a range of mental disorders that are characterized by distress, but not necessarily involving a loss of contact with reality.",0.08,0.06
26,0,"Okay, so I need to figure out which of the given options contributes to a favorable prognosis for psychotherapy.",0.06,0.06
26,1,"The options are (A) Along history of neurosis, (B) Dependency, (C) Strong reinforcement of symptoms, and (D) Misery.",0.12,0.06
121,1,"The question gives four options, and I need to choose the correct one.",0.24,0.06
119,7,"Behaviorism focuses on observable behaviors and learning processes, like conditioning.",0.24,0.06
715,1,"The options are (A) all productive resources, (B) all natural resources, (C) farmland only, and (D) real estate.",0.06,0.06
700,8,"From what I remember, in criminal cases, a defendant can sometimes offer evidence of their good character to show that they're less likely to commit a crime.",0.32,0.06
119,6,"Now, looking at the answer choices from a behaviorist perspective.",0.18,0.06
18,10,"The key here is whether these covenants run with the land, which would allow the buyer to sue the original grantor (the farmer) even though the buyer is not in privity with the farmer.",0.48,0.06
295,6,"First, I remember that when the government deals with property, especially selling it, there are legal principles they have to follow.",0.3,0.06
324,3,"Moshe Szyf's work, if I recall correctly, focuses on how stress during pregnancy affects the baby.",0.2,0.06
164,7,The question is about conflicting with the tradition of relying on ancient philosophers like Aristotle.,0.62,0.05999999999999994
199,7,The question is about conflicting with the tradition of relying on ancient philosophers like Aristotle.,0.62,0.05999999999999994
68,9,"I remember they were a group that emerged in the 16th and 17th centuries, part of the English Reformation.",0.96,0.05999999999999994
960,3,"In chronic HIV infection, these cells are present but not effective.",0.46,0.05999999999999994
684,2,Let me try to break this down.,0.6,0.05999999999999994
399,12,"But antisocial traits might not stem from such issues, so the effect might be limited.",0.96,0.05999999999999994
877,1,Let me try to break it down.,0.18,0.05755102040816329
295,1,Let me try to break it down.,0.18,0.05755102040816329
